RestaurantID,RestaurantName,CountryCode,Countryname,City,Locality,Longitude,Latitude,Cuisines,Currency,Has_Table_booking,Has_Online_delivery,Is_delivering_now,Switch_to_order_menu,Price_range,Votes,Average_Cost_for_two,Rating,Date Opening,Year,Month No,Day,Month Name,Quarter,Week of Year,Day Name,Finacial Quarter
18435314,Punjabi's Veg Grill,1,India,New Delhi,Geeta Colony,77.2767689,28.6507753,North Indian,Indian Rupees(Rs.),No,No,No,No,1,0,300,1,21-09-2013,2013,9,21,September,Q3,38,Saturday,FQ-2
18378015,Tasty Tandoor,1,India,New Delhi,Geeta Colony,77.27505159,28.65821556,North Indian,Indian Rupees(Rs.),No,No,No,No,1,0,200,1,10-09-2016,2016,9,10,September,Q3,37,Saturday,FQ-2
18424905,Taste of Spice,1,India,New Delhi,Lajpat Nagar 1,77.2413122,28.5783107,North Indian,Indian Rupees(Rs.),No,Yes,No,No,1,0,400,1,25-09-2018,2018,9,25,September,Q3,39,Tuesday,FQ-2
18180072,Kolcata Bengali Dhaba,1,India,New Delhi,Mahipalpur,77.1239323,28.5435869,North Indian,Indian Rupees(Rs.),No,No,No,No,1,0,100,1,06-09-2018,2018,9,6,September,Q3,36,Thursday,FQ-2
18415377,Sunil Punjabi Dhaba,1,India,New Delhi,Mahipalpur,77.1297061,28.5413686,North Indian,Indian Rupees(Rs.),No,No,No,No,1,0,150,1,17-09-2013,2013,9,17,September,Q3,38,Tuesday,FQ-2
18421485,Bikaner Restaurant,1,India,New Delhi,Mukherjee Nagar,77.2081351,28.699566,North Indian,Indian Rupees(Rs.),No,No,No,No,1,0,100,1,03-09-2018,2018,9,3,September,Q3,36,Monday,FQ-2
312413,Just In,1,India,New Delhi,Mukherjee Nagar,77.2190942,28.7094798,North Indian,Indian Rupees(Rs.),No,No,No,No,1,0,200,1,16-09-2011,2011,9,16,September,Q3,38,Friday,FQ-2
303497,Shri Shyam Ji Shudh Shakahari Bhojnalaya,1,India,New Delhi,Najafgarh,76.9748922,28.6112536,North Indian,Indian Rupees(Rs.),No,No,No,No,1,0,150,1,21-09-2014,2014,9,21,September,Q3,39,Sunday,FQ-2
18354644,Shree Bhojnalaya,1,India,New Delhi,New Friends Colony,77.27276199,28.56077074,North Indian,Indian Rupees(Rs.),No,No,No,No,1,0,100,1,09-09-2012,2012,9,9,September,Q3,37,Sunday,FQ-2
18366001,Baba Ka Dhaba,1,India,New Delhi,Palam,77.0902799,28.5828978,North Indian,Indian Rupees(Rs.),No,No,No,No,1,0,200,1,21-09-2014,2014,9,21,September,Q3,39,Sunday,FQ-2
18486845,Kaka Da Dhaba,1,India,New Delhi,R K Puram,77.1741183,28.5771926,North Indian,Indian Rupees(Rs.),No,No,No,No,1,0,100,1,24-09-2012,2012,9,24,September,Q3,39,Monday,FQ-2
18424202,Famous Parantha and Poori Sabzi,1,India,New Delhi,Vasundhara Enclave,77.3085095,28.5893763,North Indian,Indian Rupees(Rs.),No,No,No,No,1,0,50,1,20-09-2014,2014,9,20,September,Q3,38,Saturday,FQ-2
18472678,Garam Masala,1,India,New Delhi,Defence Colony,77.2254202,28.5728608,North Indian,Indian Rupees(Rs.),No,No,No,No,1,0,300,1,10-08-2013,2013,8,10,August,Q3,32,Saturday,FQ-2
18209806,Zaika-E-Chaap Express,1,India,New Delhi,Dilshad Garden,77.30820905,28.67788563,North Indian,Indian Rupees(Rs.),No,No,No,No,1,0,250,1,20-08-2010,2010,8,20,August,Q3,34,Friday,FQ-2
18286922,Tandoori Nature,1,India,New Delhi,Jangpura,77.2479992,28.5832431,North Indian,Indian Rupees(Rs.),No,No,No,No,1,0,400,1,24-08-2017,2017,8,24,August,Q3,34,Thursday,FQ-2
18458302,Tinker Koch,1,India,New Delhi,Jangpura,77.2474752,28.5839782,North Indian,Indian Rupees(Rs.),No,No,No,No,1,0,300,1,15-08-2013,2013,8,15,August,Q3,33,Thursday,FQ-2
7362,Vaishno Da Dhaba,1,India,New Delhi,Mahipalpur,77.1230334,28.5451138,North Indian,Indian Rupees(Rs.),No,No,No,No,1,0,200,1,24-08-2010,2010,8,24,August,Q3,35,Tuesday,FQ-2
18466400,Desi Thaat Amritsari Naan,1,India,New Delhi,Mukherjee Nagar,77.2091154,28.7146792,North Indian,Indian Rupees(Rs.),No,No,No,No,1,0,300,1,13-08-2015,2015,8,13,August,Q3,33,Thursday,FQ-2
18361779,Haryana Bhojnalaya,1,India,New Delhi,Mukherjee Nagar,77.2187133,28.7092358,North Indian,Indian Rupees(Rs.),No,No,No,No,1,0,100,1,24-08-2011,2011,8,24,August,Q3,35,Wednesday,FQ-2
18354672,Karol Bagh Ke Chhole Bhature,1,India,New Delhi,Najafgarh,76.9890278,28.5996154,North Indian,Indian Rupees(Rs.),No,No,No,No,1,0,150,1,21-08-2017,2017,8,21,August,Q3,34,Monday,FQ-2
18464641,Bala Ji Rasoi,1,India,New Delhi,Nangloi,77.06247076,28.67583363,North Indian,Indian Rupees(Rs.),No,No,No,No,1,0,350,1,09-08-2012,2012,8,9,August,Q3,32,Thursday,FQ-2
18312665,Best Chicken Corner,1,India,New Delhi,Nangloi,77.0688571,28.6823752,North Indian,Indian Rupees(Rs.),No,No,No,No,2,0,650,1,04-08-2010,2010,8,4,August,Q3,32,Wednesday,FQ-2
18312572,Avatar Da Dhaba,1,India,New Delhi,Naraina,77.1364744,28.6205175,North Indian,Indian Rupees(Rs.),No,No,No,No,1,0,200,1,13-08-2017,2017,8,13,August,Q3,33,Sunday,FQ-2
18349241,Curry Man,1,India,New Delhi,Naraina,0,0,North Indian,Indian Rupees(Rs.),No,No,No,No,1,0,200,1,06-08-2016,2016,8,6,August,Q3,32,Saturday,FQ-2
18355121,Delicious Eating Corner,1,India,New Delhi,Nehru Place,77.2511121,28.5471678,North Indian,Indian Rupees(Rs.),No,No,No,No,1,0,400,1,24-08-2013,2013,8,24,August,Q3,34,Saturday,FQ-2
18289272,Massi's Kitchen,1,India,New Delhi,Pandav Nagar,77.2857811,28.6238533,North Indian,Indian Rupees(Rs.),No,No,No,No,1,0,200,1,06-08-2014,2014,8,6,August,Q3,32,Wednesday,FQ-2
18449949,Roll Junction,1,India,New Delhi,Pandav Nagar,0,0,North Indian,Indian Rupees(Rs.),No,No,No,No,1,0,150,1,08-08-2010,2010,8,8,August,Q3,33,Sunday,FQ-2
18451571,Amritsari Naan,1,India,New Delhi,Pitampura,77.141747,28.712165,North Indian,Indian Rupees(Rs.),No,No,No,No,1,0,200,1,03-08-2016,2016,8,3,August,Q3,32,Wednesday,FQ-2
18446496,Parantha on Call,1,India,New Delhi,Geeta Colony,0,0,North Indian,Indian Rupees(Rs.),No,No,No,No,1,0,100,1,26-07-2018,2018,7,26,July,Q3,30,Thursday,FQ-2
18357972,Satnaam Foods,1,India,New Delhi,Mayur Vihar Phase 1,0,0,North Indian,Indian Rupees(Rs.),No,No,No,No,1,0,300,1,18-07-2011,2011,7,18,July,Q3,30,Monday,FQ-2
18375383,The Deshi Bites,1,India,New Delhi,Mayur Vihar Phase 3,77.33913861,28.60797505,North Indian,Indian Rupees(Rs.),No,No,No,No,2,0,500,1,28-07-2018,2018,7,28,July,Q3,30,Saturday,FQ-2
18236975,Syall Kotian Da Dhaba,1,India,New Delhi,Moti Nagar,0,0,North Indian,Indian Rupees(Rs.),No,No,No,No,2,0,500,1,22-07-2017,2017,7,22,July,Q3,29,Saturday,FQ-2
18361767,Jyoti Dhaba,1,India,New Delhi,Mukherjee Nagar,77.2187376,28.7099879,North Indian,Indian Rupees(Rs.),No,No,No,No,1,0,150,1,04-07-2011,2011,7,4,July,Q3,28,Monday,FQ-2
304610,Sangeeta Dhaba,1,India,New Delhi,Najafgarh,77.0076551,28.6164413,North Indian,Indian Rupees(Rs.),No,No,No,No,1,0,300,1,13-07-2013,2013,7,13,July,Q3,28,Saturday,FQ-2
18352268,Little Delhi,1,India,New Delhi,R K Puram,77.1761505,28.5659747,North Indian,Indian Rupees(Rs.),No,No,No,No,2,0,500,1,13-07-2011,2011,7,13,July,Q3,29,Wednesday,FQ-2
18352180,Ok Indian & Chinese Food Corner,1,India,New Delhi,R K Puram,77.10044246,28.60913476,North Indian,Indian Rupees(Rs.),No,No,No,No,1,0,200,1,03-07-2011,2011,7,3,July,Q3,28,Sunday,FQ-2
18354987,Foodies,1,India,New Delhi,Sainik Farms,77.20467545,28.51453131,North Indian,Indian Rupees(Rs.),No,No,No,No,1,0,350,1,20-07-2014,2014,7,20,July,Q3,30,Sunday,FQ-2
18355147,Star Restaurant,1,India,New Delhi,Sainik Farms,77.19856001,28.51784764,North Indian,Indian Rupees(Rs.),No,No,No,No,1,0,100,1,02-07-2014,2014,7,2,July,Q3,27,Wednesday,FQ-2
18361206,Punjabi Flavour,1,India,New Delhi,Civil Lines,77.2212499,28.6919529,North Indian,Indian Rupees(Rs.),No,No,No,No,1,0,100,1,16-06-2014,2014,6,16,June,Q2,25,Monday,FQ-1
18292467,Anupam Jalpan,1,India,New Delhi,Daryaganj,77.2436136,28.6450853,North Indian,Indian Rupees(Rs.),No,No,No,No,1,0,200,1,23-06-2018,2018,6,23,June,Q2,25,Saturday,FQ-1
18378032,Asia,1,India,New Delhi,Dilshad Garden,77.3194607,28.6803726,North Indian,Indian Rupees(Rs.),No,No,No,No,2,0,500,1,20-06-2010,2010,6,20,June,Q2,26,Sunday,FQ-1
18449634,Peshawari Mehel,1,India,New Delhi,Gujranwala Town,77.1921439,28.6990208,North Indian,Indian Rupees(Rs.),No,No,No,No,1,0,400,1,15-06-2017,2017,6,15,June,Q2,24,Thursday,FQ-1
18424902,All About Food,1,India,New Delhi,Hauz Khas,77.2093815,28.5605085,North Indian,Indian Rupees(Rs.),No,No,No,No,1,0,100,1,05-06-2015,2015,6,5,June,Q2,23,Friday,FQ-1
18421482,Breakfast Hut,1,India,New Delhi,Krishna Nagar,77.2822453,28.6555214,North Indian,Indian Rupees(Rs.),No,No,No,No,1,0,200,1,10-06-2012,2012,6,10,June,Q2,24,Sunday,FQ-1
18425148,Shri Ram Dhaba,1,India,New Delhi,Lajpat Nagar 1,77.2423223,28.5755255,North Indian,Indian Rupees(Rs.),No,No,No,No,1,0,200,1,18-06-2015,2015,6,18,June,Q2,25,Thursday,FQ-1
18410302,The Celiac Kitchen,1,India,New Delhi,Lajpat Nagar 1,0,0,North Indian,Indian Rupees(Rs.),No,No,No,No,2,0,500,1,15-06-2013,2013,6,15,June,Q2,24,Saturday,FQ-1
8033,Tip Top Eating Corner,1,India,New Delhi,Mayur Vihar Phase 1,77.3093426,28.5905357,North Indian,Indian Rupees(Rs.),No,No,No,No,1,0,100,1,27-06-2018,2018,6,27,June,Q2,26,Wednesday,FQ-1
18440429,K.D Corner,1,India,New Delhi,Mayur Vihar Phase 2,77.3094479,28.6232139,North Indian,Indian Rupees(Rs.),No,No,No,No,1,0,300,1,25-06-2018,2018,6,25,June,Q2,26,Monday,FQ-1
18489545,Rajdhani Restaurant,1,India,New Delhi,MG Road,77.126809,28.5456553,North Indian,Indian Rupees(Rs.),No,No,No,No,1,0,200,1,16-06-2012,2012,6,16,June,Q2,24,Saturday,FQ-1
18489852,Uttrakhand Hotel,1,India,New Delhi,MG Road,77.1606287,28.4949478,North Indian,Indian Rupees(Rs.),No,No,No,No,1,0,200,1,08-06-2017,2017,6,8,June,Q2,23,Thursday,FQ-1
18449786,Fresh Fast Food,1,India,New Delhi,Mukherjee Nagar,77.2187711,28.7091683,North Indian,Indian Rupees(Rs.),No,No,No,No,1,0,100,1,01-06-2017,2017,6,1,June,Q2,22,Thursday,FQ-1
18361771,NIK's Chicken Corner,1,India,New Delhi,Mukherjee Nagar,77.2188042,28.7089927,North Indian,Indian Rupees(Rs.),No,No,No,No,1,0,300,1,10-06-2018,2018,6,10,June,Q2,24,Sunday,FQ-1
18449667,Taneja Corner,1,India,New Delhi,Mukherjee Nagar,77.2188953,28.7093068,North Indian,Indian Rupees(Rs.),No,No,No,No,1,0,200,1,19-06-2015,2015,6,19,June,Q2,25,Friday,FQ-1
18017260,Babu Soup Wala,1,India,New Delhi,Nangloi,77.0681466,28.6818432,North Indian,Indian Rupees(Rs.),No,No,No,No,1,0,300,1,16-06-2011,2011,6,16,June,Q2,25,Thursday,FQ-1
18432628,Aloo Bhaji Restaurant,1,India,New Delhi,Okhla Phase 1,0,0,North Indian,Indian Rupees(Rs.),No,No,No,No,2,0,500,1,12-06-2012,2012,6,12,June,Q2,24,Tuesday,FQ-1
18466429,Pritam Tiffin Service,1,India,New Delhi,Palam,77.0875638,28.5867302,North Indian,Indian Rupees(Rs.),No,No,No,No,1,0,100,1,27-06-2014,2014,6,27,June,Q2,26,Friday,FQ-1
18312463,Chhotu Restaurant,1,India,New Delhi,Qutab Institutional Area,77.186376,28.5424845,North Indian,Indian Rupees(Rs.),No,No,No,No,1,0,350,1,13-06-2012,2012,6,13,June,Q2,24,Wednesday,FQ-1
18306540,Shree Jagannath Restaurant,1,India,New Delhi,Qutab Institutional Area,0,0,North Indian,Indian Rupees(Rs.),No,No,No,No,1,0,350,1,28-06-2017,2017,6,28,June,Q2,26,Wednesday,FQ-1
18355145,Janta Canteen,1,India,New Delhi,Sainik Farms,77.19703753,28.50085983,North Indian,Indian Rupees(Rs.),No,No,No,No,1,0,150,1,15-06-2010,2010,6,15,June,Q2,25,Tuesday,FQ-1
18357948,Sansar Hotel,1,India,New Delhi,Sarita Vihar,77.2976641,28.532348,North Indian,Indian Rupees(Rs.),No,No,No,No,1,0,300,1,04-06-2015,2015,6,4,June,Q2,23,Thursday,FQ-1
18455547,Jiya Amritsari Naan,1,India,New Delhi,Subhash Nagar,77.1194054,28.634274,North Indian,Indian Rupees(Rs.),No,No,No,No,1,0,200,1,02-06-2015,2015,6,2,June,Q2,23,Tuesday,FQ-1
305567,Sushil Punjabi Vaishno Dhaba,1,India,New Delhi,Subhash Nagar,77.1077234,28.6386142,North Indian,Indian Rupees(Rs.),No,No,No,No,1,0,150,1,12-06-2018,2018,6,12,June,Q2,24,Tuesday,FQ-1
18445361,Veg Food Express,1,India,New Delhi,Vivek Vihar,0,0,North Indian,Indian Rupees(Rs.),No,No,No,No,1,0,400,1,27-06-2014,2014,6,27,June,Q2,26,Friday,FQ-1
18472628,Insane Foods,1,India,New Delhi,Geeta Colony,0,0,North Indian,Indian Rupees(Rs.),No,No,No,No,1,0,350,1,22-05-2016,2016,5,22,May,Q2,22,Sunday,FQ-1
18454468,Lahori Food,1,India,New Delhi,Jama Masjid,77.2333916,28.6493023,North Indian,Indian Rupees(Rs.),No,No,No,No,1,0,400,1,22-05-2011,2011,5,22,May,Q2,22,Sunday,FQ-1
18416845,Al-Karim,1,India,New Delhi,Mahipalpur,77.1254605,28.5459741,North Indian,Indian Rupees(Rs.),No,No,No,No,1,0,350,1,27-05-2012,2012,5,27,May,Q2,22,Sunday,FQ-1
18414467,Chatori Zubaan Chur Chur Naan,1,India,New Delhi,Mahipalpur,77.1167352,28.5386133,North Indian,Indian Rupees(Rs.),No,No,No,No,1,0,100,1,07-05-2011,2011,5,7,May,Q2,19,Saturday,FQ-1
18460302,Khalsa Eating Point,1,India,New Delhi,Naraina,77.1470434,28.6271441,North Indian,Indian Rupees(Rs.),No,No,No,No,1,0,300,1,03-05-2018,2018,5,3,May,Q2,18,Thursday,FQ-1
18396955,The Taste of Tandoor,1,India,New Delhi,Preet Vihar,77.2909616,28.634305,North Indian,Indian Rupees(Rs.),No,No,No,No,1,0,300,1,16-05-2010,2010,5,16,May,Q2,21,Sunday,FQ-1
18470757,Rasoi - The Indian Zaika,1,India,New Delhi,Sainik Farms,77.2046316,28.5144607,North Indian,Indian Rupees(Rs.),No,No,No,No,1,0,350,1,22-05-2018,2018,5,22,May,Q2,21,Tuesday,FQ-1
18355143,Shree Balaji Bhojnalaya,1,India,New Delhi,Sainik Farms,77.19673578,28.50050685,North Indian,Indian Rupees(Rs.),No,No,No,No,1,0,100,1,28-05-2015,2015,5,28,May,Q2,22,Thursday,FQ-1
18489535,Night Diner,1,India,New Delhi,Shalimar Bagh,0,0,North Indian,Indian Rupees(Rs.),No,No,No,No,1,0,400,1,10-05-2014,2014,5,10,May,Q2,19,Saturday,FQ-1
18424638,Anupam Eating Point,1,India,New Delhi,Vasundhara Enclave,77.3074392,28.5908336,North Indian,Indian Rupees(Rs.),No,No,No,No,1,0,150,1,12-05-2018,2018,5,12,May,Q2,19,Saturday,FQ-1
18424656,Rudra The Dhaba,1,India,New Delhi,Vasundhara Enclave,77.3065745,28.5914473,North Indian,Indian Rupees(Rs.),No,No,No,No,1,0,200,1,02-05-2011,2011,5,2,May,Q2,19,Monday,FQ-1
18396171,Baba Chicken Ludhiana Wale,1,India,New Delhi,Chittaranjan Park,77.24996019,28.54047929,North Indian,Indian Rupees(Rs.),No,No,No,No,1,0,400,1,11-04-2011,2011,4,11,April,Q2,16,Monday,FQ-1
18352684,Front Food Corner,1,India,New Delhi,Hauz Khas,77.2043423,28.5418706,North Indian,Indian Rupees(Rs.),No,No,No,No,1,0,50,1,28-04-2012,2012,4,28,April,Q2,17,Saturday,FQ-1
18441696,Jain Restaurant,1,India,New Delhi,IP Extension,77.2995973,28.630479,North Indian,Indian Rupees(Rs.),Yes,No,No,No,2,0,500,1,23-04-2011,2011,4,23,April,Q2,17,Saturday,FQ-1
312000,Pandit Dhaba,1,India,New Delhi,Karol Bagh,77.2032841,28.6585277,North Indian,Indian Rupees(Rs.),No,No,No,No,1,0,300,1,25-04-2014,2014,4,25,April,Q2,17,Friday,FQ-1
18377904,Break Fast Junction,1,India,New Delhi,Krishna Nagar,77.28215106,28.65558682,North Indian,Indian Rupees(Rs.),No,No,No,No,1,0,200,1,25-04-2016,2016,4,25,April,Q2,18,Monday,FQ-1
18264993,Food En Vouge,1,India,New Delhi,Lajpat Nagar 1,77.23921526,28.5786572,North Indian,Indian Rupees(Rs.),No,Yes,No,No,1,0,400,1,19-04-2013,2013,4,19,April,Q2,16,Friday,FQ-1
18358663,Dhaba Cash 'n' Carry Kitchen Chur Chur Naan,1,India,New Delhi,Mahipalpur,77.1181406,28.5415117,North Indian,Indian Rupees(Rs.),No,No,No,No,1,0,150,1,04-04-2018,2018,4,4,April,Q2,14,Wednesday,FQ-1
18489836,New Gaurav Dhaba,1,India,New Delhi,MG Road,77.1682117,28.5020291,North Indian,Indian Rupees(Rs.),No,No,No,No,1,0,250,1,27-04-2011,2011,4,27,April,Q2,18,Wednesday,FQ-1
18466408,Desi Dhaba,1,India,New Delhi,Mukherjee Nagar,77.2090968,28.7142165,North Indian,Indian Rupees(Rs.),No,No,No,No,1,0,400,1,16-04-2014,2014,4,16,April,Q2,16,Wednesday,FQ-1
18449657,Panj Tara,1,India,New Delhi,Mukherjee Nagar,77.2160901,28.7117332,North Indian,Indian Rupees(Rs.),No,No,No,No,2,0,500,1,06-04-2013,2013,4,6,April,Q2,14,Saturday,FQ-1
18449661,Taste Zone,1,India,New Delhi,Mukherjee Nagar,77.2192812,28.7095569,North Indian,Indian Rupees(Rs.),No,No,No,No,1,0,100,1,18-04-2011,2011,4,18,April,Q2,17,Monday,FQ-1
18354998,Kirti Food Plaza,1,India,New Delhi,Munirka,77.1706433,28.5580838,North Indian,Indian Rupees(Rs.),No,No,No,No,1,0,100,1,01-04-2016,2016,4,1,April,Q2,14,Friday,FQ-1
18423905,Nishaj Chicken Corner,1,India,New Delhi,Munirka,77.1716186,28.5566765,North Indian,Indian Rupees(Rs.),No,No,No,No,1,0,200,1,10-04-2014,2014,4,10,April,Q2,15,Thursday,FQ-1
18432200,Hotel Delhi 43,1,India,New Delhi,Najafgarh,76.9872421,28.6210795,North Indian,Indian Rupees(Rs.),Yes,No,No,No,2,0,700,1,20-04-2013,2013,4,20,April,Q2,16,Saturday,FQ-1
306710,Shiv Shakti Dhaba,1,India,New Delhi,Najafgarh,76.9909045,28.6123474,North Indian,Indian Rupees(Rs.),No,No,No,No,1,0,100,1,04-04-2011,2011,4,4,April,Q2,15,Monday,FQ-1
18478963,Ralhan Eating Corner,1,India,New Delhi,Nehru Place,77.2509547,28.5471755,North Indian,Indian Rupees(Rs.),No,No,No,No,1,0,200,1,13-04-2018,2018,4,13,April,Q2,15,Friday,FQ-1
17989108,Dinesh Ka Mithila Dhaba,1,India,New Delhi,Palam,77.0688364,28.6029698,North Indian,Indian Rupees(Rs.),No,No,No,No,1,0,150,1,07-04-2011,2011,4,7,April,Q2,15,Thursday,FQ-1
6249,Rama Fast Food,1,India,New Delhi,Preet Vihar,77.2945991,28.6398152,North Indian,Indian Rupees(Rs.),No,No,No,No,1,0,150,1,21-04-2016,2016,4,21,April,Q2,17,Thursday,FQ-1
18273597,Royal Chicken Corner,1,India,New Delhi,Shalimar Bagh,77.1605144,28.6896301,North Indian,Indian Rupees(Rs.),No,No,No,No,1,0,450,1,04-04-2015,2015,4,4,April,Q2,14,Saturday,FQ-1
18455549,Desi Kukkad,1,India,New Delhi,Subhash Nagar,77.1126948,28.6340741,North Indian,Indian Rupees(Rs.),No,No,No,No,1,0,300,1,22-04-2011,2011,4,22,April,Q2,17,Friday,FQ-1
18423889,Annapoorna Bhojanalya,1,India,New Delhi,Vasundhara Enclave,77.3062381,28.5891961,North Indian,Indian Rupees(Rs.),No,No,No,No,1,0,100,1,11-04-2017,2017,4,11,April,Q2,15,Tuesday,FQ-1
18424650,Night Munchers,1,India,New Delhi,Vasundhara Enclave,77.3071878,28.5908905,North Indian,Indian Rupees(Rs.),No,No,No,No,2,0,500,1,17-04-2011,2011,4,17,April,Q2,17,Sunday,FQ-1
18489513,Tandoori Kebab,1,India,New Delhi,Alaknanda,77.248174,28.526931,North Indian,Indian Rupees(Rs.),No,No,No,No,1,0,400,1,22-03-2018,2018,3,22,March,Q1,12,Thursday,FQ-4
18378037,Prem Rasoi,1,India,New Delhi,Dilshad Garden,77.30951831,28.68780825,North Indian,Indian Rupees(Rs.),No,No,No,No,1,0,400,1,13-03-2013,2013,3,13,March,Q1,11,Wednesday,FQ-4
18124389,Mahesh Shudh Vaishno Bhojanalya,1,India,New Delhi,GTB Nagar,77.2050808,28.6979305,North Indian,Indian Rupees(Rs.),No,No,No,No,1,0,100,1,23-03-2017,2017,3,23,March,Q1,12,Thursday,FQ-4
18451575,Majlis Foods,1,India,New Delhi,Jama Masjid,77.2355652,28.6498655,North Indian,Indian Rupees(Rs.),No,No,No,No,1,0,400,1,03-03-2014,2014,3,3,March,Q1,10,Monday,FQ-4
18292453,Shri Bala Ji Rasoi,1,India,New Delhi,Mayur Vihar Phase 1,77.296163,28.6051709,North Indian,Indian Rupees(Rs.),No,No,No,No,1,0,200,1,24-03-2010,2010,3,24,March,Q1,13,Wednesday,FQ-4
308110,Moji Dhaba,1,India,New Delhi,Moti Nagar,77.1461711,28.6621083,North Indian,Indian Rupees(Rs.),No,No,No,No,1,0,400,1,24-03-2014,2014,3,24,March,Q1,13,Monday,FQ-4
18466675,Gungun Tiffin Services,1,India,New Delhi,Mukherjee Nagar,0,0,North Indian,Indian Rupees(Rs.),No,No,No,No,1,0,200,1,25-03-2013,2013,3,25,March,Q1,13,Monday,FQ-4
18361217,Radhe Shyam Dhaba,1,India,New Delhi,Najafgarh,76.9638597,28.609072,North Indian,Indian Rupees(Rs.),No,No,No,No,1,0,250,1,11-03-2012,2012,3,11,March,Q1,11,Sunday,FQ-4
9271,Raju De Special Paneer Wale,1,India,New Delhi,Najafgarh,76.9856215,28.6100946,North Indian,Indian Rupees(Rs.),No,No,No,No,1,0,50,1,04-03-2010,2010,3,4,March,Q1,10,Thursday,FQ-4
18360900,Gupta Bhojnalya,1,India,New Delhi,Okhla Phase 1,77.2885264,28.5003643,North Indian,Indian Rupees(Rs.),No,No,No,No,1,0,300,1,04-03-2014,2014,3,4,March,Q1,10,Tuesday,FQ-4
18492960,Mouthmatics,1,India,New Delhi,Sainik Farms,0,0,North Indian,Indian Rupees(Rs.),No,No,No,No,1,0,200,1,28-03-2018,2018,3,28,March,Q1,13,Wednesday,FQ-4
18390309,Kaka's Tiffin Service,1,India,New Delhi,Sarita Vihar,77.2963255,28.5374192,North Indian,Indian Rupees(Rs.),No,No,No,No,1,0,150,1,08-03-2017,2017,3,8,March,Q1,10,Wednesday,FQ-4
18377898,Anjali Resaturant,1,India,New Delhi,Vasundhara Enclave,77.3066274,28.5914444,North Indian,Indian Rupees(Rs.),No,No,No,No,1,0,200,1,14-03-2014,2014,3,14,March,Q1,11,Friday,FQ-4
18375413,Rama Desi Ghee Meat Wala,1,India,New Delhi,Ashok Vihar Phase 1,0,0,North Indian,Indian Rupees(Rs.),No,No,No,No,2,0,650,1,24-02-2016,2016,2,24,February,Q1,9,Wednesday,FQ-4
302871,Punjabi Chicken,1,India,New Delhi,Chandni Chowk,77.2316689,28.6573856,North Indian,Indian Rupees(Rs.),No,No,No,No,1,0,400,1,16-02-2010,2010,2,16,February,Q1,8,Tuesday,FQ-4
6678,Kaushal Dhaba,1,India,New Delhi,Daryaganj,77.2357105,28.6410173,North Indian,Indian Rupees(Rs.),No,No,No,No,1,0,150,1,11-02-2010,2010,2,11,February,Q1,7,Thursday,FQ-4
18292472,Rajdhani Restaurant,1,India,New Delhi,Daryaganj,77.2402908,28.6451272,North Indian,Indian Rupees(Rs.),No,No,No,No,1,0,400,1,15-02-2013,2013,2,15,February,Q1,7,Friday,FQ-4
18362795,Uncle Sam,1,India,New Delhi,East of Kailash,0,0,North Indian,Indian Rupees(Rs.),No,No,No,No,1,0,200,1,11-02-2010,2010,2,11,February,Q1,7,Thursday,FQ-4
18455553,Baweja's Haandi,1,India,New Delhi,Geeta Colony,0,0,North Indian,Indian Rupees(Rs.),No,No,No,No,2,0,600,1,05-02-2017,2017,2,5,February,Q1,6,Sunday,FQ-4
18418234,Singh's,1,India,New Delhi,Geeta Colony,77.2741884,28.6543108,North Indian,Indian Rupees(Rs.),No,No,No,No,1,0,300,1,07-02-2013,2013,2,7,February,Q1,6,Thursday,FQ-4
18312623,Viceroy Bar - Hotel Classic Diplomat,1,India,New Delhi,"Hotel Classic Diplomat, Mahipalpur",77.1259999,28.5479078,North Indian,Indian Rupees(Rs.),Yes,No,No,No,2,0,800,1,07-02-2013,2013,2,7,February,Q1,6,Thursday,FQ-4
18414503,Sunny Restaurant & Tiffin,1,India,New Delhi,JNU,77.1810026,28.5488714,North Indian,Indian Rupees(Rs.),No,No,No,No,1,0,400,1,10-02-2018,2018,2,10,February,Q1,6,Saturday,FQ-4
18376513,Khalsa Dhaba,1,India,New Delhi,Krishna Nagar,77.2730949,28.6590094,North Indian,Indian Rupees(Rs.),No,No,No,No,1,0,350,1,23-02-2010,2010,2,23,February,Q1,9,Tuesday,FQ-4
18361765,Dhaba Express,1,India,New Delhi,Mukherjee Nagar,77.2214682,28.7115817,North Indian,Indian Rupees(Rs.),No,No,No,No,1,0,200,1,07-02-2017,2017,2,7,February,Q1,6,Tuesday,FQ-4
18241864,Om Shanti Foods,1,India,New Delhi,Mukherjee Nagar,77.2185861,28.7094348,North Indian,Indian Rupees(Rs.),No,No,No,No,1,0,100,1,24-02-2012,2012,2,24,February,Q1,8,Friday,FQ-4
18228878,Aggarwal Sweets,1,India,New Delhi,Palam,77.0976348,28.5955838,North Indian,Indian Rupees(Rs.),No,No,No,No,1,0,300,1,16-02-2016,2016,2,16,February,Q1,8,Tuesday,FQ-4
5463,Negi Restaurant,1,India,New Delhi,Daryaganj,77.2400213,28.6411593,North Indian,Indian Rupees(Rs.),No,No,No,No,1,0,150,1,19-01-2012,2012,1,19,January,Q1,3,Thursday,FQ-4
18356776,Ghar Ka Khana,1,India,New Delhi,East of Kailash,77.25076921,28.55558547,North Indian,Indian Rupees(Rs.),No,No,No,No,1,0,100,1,24-01-2018,2018,1,24,January,Q1,4,Wednesday,FQ-4
18349764,Bansal Foods,1,India,New Delhi,Krishna Nagar,0,0,North Indian,Indian Rupees(Rs.),No,No,No,No,2,0,600,1,11-01-2017,2017,1,11,January,Q1,2,Wednesday,FQ-4
18415370,Mr. Billiken,1,India,New Delhi,Lado Sarai,77.1941204,28.5278927,North Indian,Indian Rupees(Rs.),No,No,No,No,2,0,600,1,24-01-2014,2014,1,24,January,Q1,4,Friday,FQ-4
18485962,Bawarchi's Canteen,1,India,New Delhi,Mukherjee Nagar,77.21114504,28.70302109,North Indian,Indian Rupees(Rs.),No,No,No,No,1,0,100,1,14-01-2010,2010,1,14,January,Q1,3,Thursday,FQ-4
18378051,Spicy Curry,1,India,New Delhi,Nangloi,77.0672844,28.6812756,North Indian,Indian Rupees(Rs.),No,No,No,No,1,0,350,1,16-01-2011,2011,1,16,January,Q1,4,Sunday,FQ-4
18441669,Food State,1,India,New Delhi,Preet Vihar,77.2943559,28.6405983,North Indian,Indian Rupees(Rs.),No,No,No,No,1,0,300,1,28-01-2018,2018,1,28,January,Q1,5,Sunday,FQ-4
18489530,Pakeeza Chicken Corner,1,India,New Delhi,R K Puram,77.1675125,28.5652412,North Indian,Indian Rupees(Rs.),No,No,No,No,1,0,200,1,01-01-2018,2018,1,1,January,Q1,1,Monday,FQ-4
18390082,Aunty's Kitchen,1,India,New Delhi,Daryaganj,77.2420496,28.6448122,North Indian,Indian Rupees(Rs.),No,No,No,No,1,0,100,1,02-12-2016,2016,12,2,December,Q4,49,Friday,FQ-3
18449652,Delhi 6 Foods,1,India,New Delhi,Daryaganj,0,0,North Indian,Indian Rupees(Rs.),No,No,No,No,1,0,300,1,18-12-2018,2018,12,18,December,Q4,51,Tuesday,FQ-3
18288623,Fry Centre,1,India,New Delhi,Daryaganj,77.2404428,28.6482292,North Indian,Indian Rupees(Rs.),No,No,No,No,1,0,200,1,04-12-2013,2013,12,4,December,Q4,49,Wednesday,FQ-3
18435822,Mahavrer Chap Express,1,India,New Delhi,Dilshad Garden,77.3182032,28.6808405,North Indian,Indian Rupees(Rs.),No,No,No,No,1,0,300,1,13-12-2011,2011,12,13,December,Q4,51,Tuesday,FQ-3
18435787,Kailash Vaishno Dhaba,1,India,New Delhi,Geeta Colony,77.2705947,28.656203,North Indian,Indian Rupees(Rs.),No,No,No,No,1,0,200,1,28-12-2016,2016,12,28,December,Q4,53,Wednesday,FQ-3
18425757,Desi Tadka,1,India,New Delhi,Hauz Khas,77.2098425,28.560245,North Indian,Indian Rupees(Rs.),No,No,No,No,1,0,200,1,19-12-2016,2016,12,19,December,Q4,52,Monday,FQ-3
18425738,Sher -E- Punjab,1,India,New Delhi,Hauz Khas,77.2081917,28.5608475,North Indian,Indian Rupees(Rs.),No,No,No,No,1,0,350,1,10-12-2012,2012,12,10,December,Q4,50,Monday,FQ-3
18423101,Kebabish,1,India,New Delhi,Krishna Nagar,77.2777796,28.6525016,North Indian,Indian Rupees(Rs.),No,No,No,No,2,0,550,1,04-12-2012,2012,12,4,December,Q4,49,Tuesday,FQ-3
18429161,Gian Ji Punjabi Dhaba,1,India,New Delhi,Lajpat Nagar 1,77.2529469,28.569441,North Indian,Indian Rupees(Rs.),No,No,No,No,1,0,150,1,14-12-2016,2016,12,14,December,Q4,51,Wednesday,FQ-3
18403469,Aapka Mangal Restaurant,1,India,New Delhi,Mahipalpur,77.1238424,28.5446537,North Indian,Indian Rupees(Rs.),No,No,No,No,2,0,500,1,04-12-2010,2010,12,4,December,Q4,49,Saturday,FQ-3
18489534,Sunita Dhaba,1,India,New Delhi,Mahipalpur,77.1279227,28.549416,North Indian,Indian Rupees(Rs.),No,No,No,No,1,0,250,1,09-12-2013,2013,12,9,December,Q4,50,Monday,FQ-3
18489832,Lotus Kitchen,1,India,New Delhi,MG Road,77.1444856,28.4945886,North Indian,Indian Rupees(Rs.),No,No,No,No,1,0,100,1,15-12-2011,2011,12,15,December,Q4,51,Thursday,FQ-3
18471235,Aditya Da Vaishno Dhaba,1,India,New Delhi,Najafgarh,77.012198,28.6180639,North Indian,Indian Rupees(Rs.),No,No,No,No,1,0,250,1,23-12-2013,2013,12,23,December,Q4,52,Monday,FQ-3
18469981,Dana Pani,1,India,New Delhi,Najafgarh,77.0094083,28.6170305,North Indian,Indian Rupees(Rs.),No,No,No,No,1,0,250,1,16-12-2018,2018,12,16,December,Q4,51,Sunday,FQ-3
312848,Punjabi Tadka,1,India,New Delhi,Naraina,77.146539,28.6296677,North Indian,Indian Rupees(Rs.),No,No,No,No,1,0,250,1,16-12-2018,2018,12,16,December,Q4,51,Sunday,FQ-3
18439705,The Hubbub Cafe and Restaurant,1,India,New Delhi,Qutab Institutional Area,77.189514,28.546945,North Indian,Indian Rupees(Rs.),No,No,No,No,2,0,500,1,15-12-2012,2012,12,15,December,Q4,50,Saturday,FQ-3
18418243,Uttarakhand Eating Point,1,India,New Delhi,Shakarpur,77.2816189,28.6316688,North Indian,Indian Rupees(Rs.),No,No,No,No,1,0,200,1,16-12-2018,2018,12,16,December,Q4,51,Sunday,FQ-3
18429577,Mamma Drools,1,India,New Delhi,Dilshad Garden,77.3151641,28.6784646,North Indian,Indian Rupees(Rs.),No,No,No,No,1,0,200,1,15-11-2015,2015,11,15,November,Q4,47,Sunday,FQ-3
18421462,Prem Ji Delhi Wale,1,India,New Delhi,Geeta Colony,77.2743467,28.6541382,North Indian,Indian Rupees(Rs.),No,No,No,No,1,0,250,1,23-11-2010,2010,11,23,November,Q4,48,Tuesday,FQ-3
18464633,Aap Ki Khatir,1,India,New Delhi,Gujranwala Town,77.1918129,28.6988557,North Indian,Indian Rupees(Rs.),No,No,No,No,1,0,400,1,20-11-2012,2012,11,20,November,Q4,47,Tuesday,FQ-3
18423145,Rai Ji Caterers,1,India,New Delhi,Lodhi Road,77.2284355,28.5823457,North Indian,Indian Rupees(Rs.),No,No,No,No,1,0,400,1,10-11-2012,2012,11,10,November,Q4,45,Saturday,FQ-3
18358661,Kaka De Dhaba,1,India,New Delhi,Mahipalpur,77.1228536,28.5454551,North Indian,Indian Rupees(Rs.),No,No,No,No,1,0,350,1,01-11-2016,2016,11,1,November,Q4,45,Tuesday,FQ-3
18342574,Apni Rasoi,1,India,New Delhi,Moti Nagar,77.1421854,28.6575323,North Indian,Indian Rupees(Rs.),No,No,No,No,2,0,500,1,13-11-2015,2015,11,13,November,Q4,46,Friday,FQ-3
18449664,Raja Rasoi,1,India,New Delhi,Mukherjee Nagar,77.2187996,28.7093643,North Indian,Indian Rupees(Rs.),No,No,No,No,1,0,200,1,05-11-2015,2015,11,5,November,Q4,45,Thursday,FQ-3
306177,Gulati Ki Rasoi,1,India,New Delhi,Nangloi,77.0719688,28.69123205,North Indian,Indian Rupees(Rs.),No,No,No,No,1,0,200,1,23-11-2011,2011,11,23,November,Q4,48,Wednesday,FQ-3
18424661,Bikaner Rasoi,1,India,New Delhi,Vasundhara Enclave,77.3159908,28.601005,North Indian,Indian Rupees(Rs.),No,No,No,No,1,0,250,1,25-11-2010,2010,11,25,November,Q4,48,Thursday,FQ-3
18423118,Old Moradabadi Chicken Corner,1,India,New Delhi,Vasundhara Enclave,77.30620712,28.5890838,North Indian,Indian Rupees(Rs.),No,No,No,No,1,0,400,1,13-11-2012,2012,11,13,November,Q4,46,Tuesday,FQ-3
18457050,Puran Dhaba,1,India,New Delhi,Ashok Vihar Phase 1,77.1724663,28.6802986,North Indian,Indian Rupees(Rs.),No,No,No,No,1,0,200,1,13-10-2014,2014,10,13,October,Q4,42,Monday,FQ-3
18420653,Tawa King,1,India,New Delhi,Delhi University-GTB Nagar,77.2027451,28.6949307,North Indian,Indian Rupees(Rs.),No,No,No,No,1,0,350,1,28-10-2014,2014,10,28,October,Q4,44,Tuesday,FQ-3
18361755,Shudh Vaishno Dhaba,1,India,New Delhi,GTB Nagar,77.2048113,28.6990689,North Indian,Indian Rupees(Rs.),No,No,No,No,1,0,200,1,25-10-2018,2018,10,25,October,Q4,43,Thursday,FQ-3
18481278,Mirch Masala Restaurant,1,India,New Delhi,India Gate,77.1981633,28.6086732,North Indian,Indian Rupees(Rs.),No,No,No,No,1,0,400,1,27-10-2014,2014,10,27,October,Q4,44,Monday,FQ-3
18425740,Food Corner,1,India,New Delhi,Kailash Colony,77.241099,28.5527158,North Indian,Indian Rupees(Rs.),No,No,No,No,1,0,100,1,06-10-2018,2018,10,6,October,Q4,40,Saturday,FQ-3
18357541,Mukesh Bhojnalaya,1,India,New Delhi,Mahipalpur,77.1248542,28.5430525,North Indian,Indian Rupees(Rs.),No,No,No,No,1,0,300,1,11-10-2016,2016,10,11,October,Q4,42,Tuesday,FQ-3
312970,New Royal Blue Dhaba,1,India,New Delhi,Mahipalpur,77.1231232,28.5435989,North Indian,Indian Rupees(Rs.),No,No,No,No,1,0,300,1,07-10-2016,2016,10,7,October,Q4,41,Friday,FQ-3
18449653,Food Campus,1,India,New Delhi,Mukherjee Nagar,77.2163995,28.7140298,North Indian,Indian Rupees(Rs.),No,No,No,No,1,0,100,1,12-10-2015,2015,10,12,October,Q4,42,Monday,FQ-3
18357954,Punjabi Delight,1,India,New Delhi,Mukherjee Nagar,77.215591,28.7126375,North Indian,Indian Rupees(Rs.),No,No,No,No,1,0,300,1,01-10-2012,2012,10,1,October,Q4,40,Monday,FQ-3
305699,Dilkhush Dhaba,1,India,New Delhi,Nangloi,77.0695034,28.6819199,North Indian,Indian Rupees(Rs.),No,No,No,No,1,0,100,1,13-10-2013,2013,10,13,October,Q4,42,Sunday,FQ-3
304831,Khana Khazana,1,India,New Delhi,Nangloi,77.07009997,28.68654323,North Indian,Indian Rupees(Rs.),No,No,No,No,1,0,200,1,03-10-2018,2018,10,3,October,Q4,40,Wednesday,FQ-3
304782,Ramesh Caterers & Dhaba,1,India,New Delhi,Nangloi,77.0721833,28.6536022,North Indian,Indian Rupees(Rs.),No,No,No,No,1,0,150,1,27-10-2017,2017,10,27,October,Q4,43,Friday,FQ-3
18368003,Foji Bhai Hotel,1,India,New Delhi,Palam,77.0864659,28.5931848,North Indian,Indian Rupees(Rs.),No,No,No,No,1,0,100,1,15-10-2014,2014,10,15,October,Q4,42,Wednesday,FQ-3
18244429,Raj Shri,1,India,New Delhi,Pandav Nagar,77.2833786,28.6180657,North Indian,Indian Rupees(Rs.),No,No,No,No,1,0,200,1,25-10-2015,2015,10,25,October,Q4,44,Sunday,FQ-3
18357819,Nutri Lunch,1,India,New Delhi,Sarita Vihar,77.2921201,28.532939,North Indian,Indian Rupees(Rs.),No,No,No,No,1,0,200,1,15-10-2018,2018,10,15,October,Q4,42,Monday,FQ-3
18430907,Rana's Food Corner,1,India,New Delhi,Subhash Nagar,77.1090147,28.6350391,North Indian,Indian Rupees(Rs.),No,No,No,No,1,0,200,1,10-10-2013,2013,10,10,October,Q4,41,Thursday,FQ-3
18424640,Soni Food Court,1,India,New Delhi,Vasundhara Enclave,77.30764378,28.59086665,North Indian,Indian Rupees(Rs.),No,No,No,No,1,0,150,1,14-10-2015,2015,10,14,October,Q4,42,Wednesday,FQ-3
18421058,V. K. Pasta,1,India,New Delhi,Anand Vihar,77.3066115,28.6595859,"Italian, Fast Food",Indian Rupees(Rs.),No,No,No,No,2,0,600,1,01-09-2018,2018,9,1,September,Q3,35,Saturday,FQ-2
18397709,Iqbal's Mughal Cuisine,1,India,New Delhi,Daryaganj,77.2414133,28.6444725,"North Indian, Mughlai",Indian Rupees(Rs.),No,No,No,No,2,0,500,1,10-09-2013,2013,9,10,September,Q3,37,Tuesday,FQ-2
18472618,Adda The Spice Affair,1,India,New Delhi,Hauz Khas,77.210758,28.5623218,"North Indian, Chinese",Indian Rupees(Rs.),No,No,No,No,2,0,500,1,18-09-2012,2012,9,18,September,Q3,38,Tuesday,FQ-2
18418229,Shi Cafe,1,India,New Delhi,Hauz Khas,77.19461381,28.55510074,"Cafe, Mexican, Continental",Indian Rupees(Rs.),No,No,No,No,3,0,1000,1,19-09-2018,2018,9,19,September,Q3,38,Wednesday,FQ-2
18445784,Nirvana The Divine Kitchen,1,India,New Delhi,Lawrence Road,77.1595266,28.6889287,"North Indian, Chinese",Indian Rupees(Rs.),No,No,No,No,2,0,700,1,18-09-2010,2010,9,18,September,Q3,38,Saturday,FQ-2
18435820,Chicago Pizza,1,India,New Delhi,"Palate of Delhi, Chanakyapuri",77.162132,28.5921448,Pizza,Indian Rupees(Rs.),No,No,No,No,2,0,600,1,22-09-2010,2010,9,22,September,Q3,39,Wednesday,FQ-2
18441688,Madras Dosa & Chinese,1,India,New Delhi,Shalimar Bagh,77.1626712,28.7066721,"South Indian, Chinese",Indian Rupees(Rs.),No,No,No,No,2,0,500,1,24-09-2018,2018,9,24,September,Q3,39,Monday,FQ-2
18337885,Tpot,1,India,New Delhi,Aerocity,77.087897,28.554463,Cafe,Indian Rupees(Rs.),No,No,No,No,2,0,800,1,06-08-2012,2012,8,6,August,Q3,32,Monday,FQ-2
18462588,Avon Kitchen,1,India,New Delhi,Ashok Vihar Phase 1,77.1736822,28.6872769,"North Indian, Mughlai, Chinese",Indian Rupees(Rs.),No,No,No,No,2,0,700,1,21-08-2018,2018,8,21,August,Q3,34,Tuesday,FQ-2
18424635,Somang House Restaurant,1,India,New Delhi,Majnu ka Tila,77.2278966,28.7008275,"Asian, Chinese",Indian Rupees(Rs.),No,No,No,No,2,0,500,1,05-08-2015,2015,8,5,August,Q3,32,Wednesday,FQ-2
18467388,Manami Japanese Restaurant,1,India,New Delhi,MG Road,77.1604883,28.4968258,Japanese,Indian Rupees(Rs.),Yes,No,No,No,3,0,1000,1,07-08-2016,2016,8,7,August,Q3,33,Sunday,FQ-2
18479008,Oye!! Shawarma,1,India,New Delhi,Rajendra Place,77.177473,28.643174,Fast Food,Indian Rupees(Rs.),No,No,No,No,2,0,500,1,17-08-2011,2011,8,17,August,Q3,34,Wednesday,FQ-2
18347812,Teedo's Cake Inn,1,India,New Delhi,Anand Vihar,77.3056481,28.6600976,"Cafe, Bakery",Indian Rupees(Rs.),No,No,No,No,2,0,500,1,02-07-2018,2018,7,2,July,Q3,27,Monday,FQ-2
18446423,Al Noor Foods,1,India,New Delhi,Ashok Vihar Phase 1,77.1731402,28.6870353,"North Indian, Mughlai",Indian Rupees(Rs.),No,No,No,No,2,0,500,1,21-07-2014,2014,7,21,July,Q3,30,Monday,FQ-2
18455513,Singh Chicken,1,India,New Delhi,GTB Nagar,77.2027704,28.7075633,"North Indian, Mughlai",Indian Rupees(Rs.),No,No,No,No,2,0,500,1,13-07-2018,2018,7,13,July,Q3,28,Friday,FQ-2
18313119,Pakeeza Restaurants,1,India,New Delhi,Jangpura,77.2463975,28.5812764,Mughlai,Indian Rupees(Rs.),No,No,No,No,2,0,500,1,16-07-2011,2011,7,16,July,Q3,29,Saturday,FQ-2
18449620,Elements - Mapple Express,1,India,New Delhi,Kailash Colony,77.243649,28.553673,"North Indian, Continental, Chinese",Indian Rupees(Rs.),Yes,No,No,No,3,0,1200,1,21-07-2018,2018,7,21,July,Q3,29,Saturday,FQ-2
18272389,Dus Bab,1,India,New Delhi,Majnu ka Tila,77.2274475,28.7000681,Tibetan,Indian Rupees(Rs.),No,No,No,No,2,0,500,1,21-07-2017,2017,7,21,July,Q3,29,Friday,FQ-2
18317483,Viceroy - The Coffee Shop,1,India,New Delhi,"MGM Club, Daryaganj",77.2431646,28.6463865,Cafe,Indian Rupees(Rs.),No,No,No,No,3,0,1000,1,09-07-2013,2013,7,9,July,Q3,28,Tuesday,FQ-2
18369764,Sahi Pakde Hain,1,India,New Delhi,Palam,77.0918982,28.5865739,"North Indian, Mughlai, Chinese",Indian Rupees(Rs.),No,No,No,No,2,0,550,1,23-07-2013,2013,7,23,July,Q3,30,Tuesday,FQ-2
18430898,13 Cafe,1,India,New Delhi,Subhash Nagar,77.1126948,28.6372986,Cafe,Indian Rupees(Rs.),No,No,No,No,2,0,500,1,20-07-2013,2013,7,20,July,Q3,29,Saturday,FQ-2
18428216,Amar Bakery,1,India,New Delhi,Anand Vihar,77.3066854,28.6595807,"Bakery, Desserts, Fast Food, Mithai",Indian Rupees(Rs.),No,No,No,No,2,0,500,1,25-06-2017,2017,6,25,June,Q2,26,Sunday,FQ-1
18435830,Habibi Express,1,India,New Delhi,Kailash Colony,77.238586,28.555918,"Lebanese, Arabian, Moroccan",Indian Rupees(Rs.),Yes,Yes,No,No,2,0,900,1,01-06-2010,2010,6,1,June,Q2,23,Tuesday,FQ-1
18357956,Rara Dragon,1,India,New Delhi,Defence Colony,77.2272935,28.5729113,Chinese,Indian Rupees(Rs.),No,No,No,No,2,0,500,1,01-05-2015,2015,5,1,May,Q2,18,Friday,FQ-1
305153,Flavours Of Delhi,1,India,New Delhi,Mahipalpur,77.1250299,28.5472207,"North Indian, Chinese, Fast Food",Indian Rupees(Rs.),No,No,No,No,2,0,650,1,05-05-2014,2014,5,5,May,Q2,19,Monday,FQ-1
18340302,Cake Point,1,India,New Delhi,MG Road,77.1501341,28.4945103,"Bakery, Desserts",Indian Rupees(Rs.),No,Yes,No,No,2,0,600,1,22-05-2015,2015,5,22,May,Q2,21,Friday,FQ-1
18397621,Mr. Confectioner - Pride Plaza Hotel,1,India,New Delhi,"Pride Plaza Hotel, Aerocity",77.122934,28.552711,Bakery,Indian Rupees(Rs.),No,No,No,No,2,0,500,1,07-05-2017,2017,5,7,May,Q2,19,Sunday,FQ-1
18472665,Behrouz Biryani,1,India,New Delhi,R K Puram,77.1671335,28.5724166,Biryani,Indian Rupees(Rs.),No,Yes,No,No,2,0,600,1,16-05-2016,2016,5,16,May,Q2,21,Monday,FQ-1
18357568,Chicken Point,1,India,New Delhi,Sarojini Nagar,77.1936712,28.5699787,"Mughlai, North Indian",Indian Rupees(Rs.),No,No,No,No,2,0,600,1,14-05-2011,2011,5,14,May,Q2,20,Saturday,FQ-1
18492103,New Sindhi Chicken Corner,1,India,New Delhi,Subhash Nagar,77.1145378,28.6369833,"North Indian, Mughlai",Indian Rupees(Rs.),No,No,No,No,2,0,500,1,26-05-2018,2018,5,26,May,Q2,21,Saturday,FQ-1
18424642,Pawan Foods,1,India,New Delhi,Dilshad Garden,77.31044468,28.68845296,"Chinese, North Indian",Indian Rupees(Rs.),No,No,No,No,2,0,500,1,16-04-2018,2018,4,16,April,Q2,16,Monday,FQ-1
311666,Mughal-E-Zaika,1,India,New Delhi,Mahipalpur,77.1237525,28.54348,"Mughlai, North Indian",Indian Rupees(Rs.),No,No,No,No,2,0,500,1,24-04-2013,2013,4,24,April,Q2,17,Wednesday,FQ-1
18446867,Swiss Gourmessa,1,India,New Delhi,MG Road,77.162106,28.4960891,Bakery,Indian Rupees(Rs.),No,No,No,No,2,0,500,1,27-04-2017,2017,4,27,April,Q2,17,Thursday,FQ-1
18438424,Dunkin' Donuts,1,India,New Delhi,"Palate of Delhi, Chanakyapuri",77.1620421,28.5921362,"Burger, Desserts, Fast Food",Indian Rupees(Rs.),No,No,No,No,2,0,600,1,26-04-2014,2014,4,26,April,Q2,17,Saturday,FQ-1
18153555,Chick N Grills,1,India,New Delhi,Shalimar Bagh,77.1668006,28.7084737,"Mughlai, Fast Food",Indian Rupees(Rs.),No,No,No,No,2,0,600,1,08-04-2018,2018,4,8,April,Q2,15,Sunday,FQ-1
18429376,Javed Bawarchi Restaurant,1,India,New Delhi,Zakir Nagar,77.2778975,28.5665297,Mughlai,Indian Rupees(Rs.),No,No,No,No,2,0,600,1,27-04-2016,2016,4,27,April,Q2,18,Wednesday,FQ-1
18441542,Moonis Kada,1,India,New Delhi,Zakir Nagar,77.28572074,28.56527732,"Mughlai, North Indian",Indian Rupees(Rs.),No,No,No,No,2,0,500,1,25-04-2011,2011,4,25,April,Q2,18,Monday,FQ-1
311544,The Cake Affairs,1,India,New Delhi,Anand Vihar,77.3170268,28.6622024,"Bakery, Desserts",Indian Rupees(Rs.),No,No,No,No,2,0,500,1,06-03-2017,2017,3,6,March,Q1,10,Monday,FQ-4
18430569,Pind Balluchi,1,India,New Delhi,Najafgarh,77.0117519,28.6179639,"North Indian, Mughlai",Indian Rupees(Rs.),Yes,No,No,No,2,0,800,1,23-03-2014,2014,3,23,March,Q1,13,Sunday,FQ-4
18014151,Shri Bikaner Sweets & Restaurant,1,India,New Delhi,Narela,77.03510278,28.79751667,"North Indian, Chinese, South Indian",Indian Rupees(Rs.),No,No,No,No,2,0,500,1,18-03-2018,2018,3,18,March,Q1,12,Sunday,FQ-4
18435289,Domino's Pizza,1,India,New Delhi,"Palate of Delhi, Chanakyapuri",77.1622219,28.5921535,"Pizza, Fast Food",Indian Rupees(Rs.),No,No,No,No,2,0,700,1,18-03-2010,2010,3,18,March,Q1,12,Thursday,FQ-4
18355117,Al- Laziz,1,India,New Delhi,East of Kailash,77.24972282,28.55566852,Mughlai,Indian Rupees(Rs.),No,No,No,No,2,0,500,1,01-02-2016,2016,2,1,February,Q1,6,Monday,FQ-4
18492048,Piper's & Grill - The Night Chef,1,India,New Delhi,GTB Nagar,77.208794,28.694348,"North Indian, Chinese, Continental",Indian Rupees(Rs.),No,No,No,No,2,0,500,1,24-02-2013,2013,2,24,February,Q1,9,Sunday,FQ-4
18358665,Coffee Shop,1,India,New Delhi,Mahipalpur,77.1137736,28.5354421,"Cafe, North Indian, Continental",Indian Rupees(Rs.),No,No,No,No,3,0,1000,1,18-02-2011,2011,2,18,February,Q1,8,Friday,FQ-4
18489842,#hashtag,1,India,New Delhi,Mehrauli,77.1818649,28.5222051,Cafe,Indian Rupees(Rs.),No,No,No,No,2,0,500,1,19-02-2015,2015,2,19,February,Q1,8,Thursday,FQ-4
18317473,Curzon - The Royal Bar,1,India,New Delhi,"MGM Club, Daryaganj",77.2430748,28.6464675,Finger Food,Indian Rupees(Rs.),Yes,No,No,No,3,0,1000,1,07-02-2014,2014,2,7,February,Q1,6,Friday,FQ-4
18232109,Kolkata Biriyani On Call,1,India,New Delhi,Pandav Nagar,77.2847283,28.6213841,Biryani,Indian Rupees(Rs.),No,No,No,No,2,0,500,1,19-02-2010,2010,2,19,February,Q1,8,Friday,FQ-4
18438896,Khaao Peeyo,1,India,New Delhi,Rajendra Place,77.177472,28.643168,Fast Food,Indian Rupees(Rs.),No,No,No,No,2,0,500,1,24-02-2012,2012,2,24,February,Q1,8,Friday,FQ-4
18357941,Facebook Fast Food,1,India,New Delhi,Sarita Vihar,77.2991003,28.5335599,"North Indian, Mughlai, Chinese",Indian Rupees(Rs.),No,No,No,No,2,0,750,1,01-02-2015,2015,2,1,February,Q1,6,Sunday,FQ-4
18446485,Pizza Hut Delivery,1,India,New Delhi,"Worldmark 1, Aerocity",77.12142371,28.54989546,"Italian, Pizza, Fast Food",Indian Rupees(Rs.),No,No,No,No,2,0,800,1,09-02-2010,2010,2,9,February,Q1,7,Tuesday,FQ-4
18435326,D-Food,1,India,New Delhi,Narela,77.04952508,28.80619877,"Chinese, Fast Food, Bakery",Indian Rupees(Rs.),No,No,No,No,2,0,500,1,18-01-2010,2010,1,18,January,Q1,4,Monday,FQ-4
18372299,Pizza King,1,India,New Delhi,Pandav Nagar,77.2842381,28.6185463,Pizza,Indian Rupees(Rs.),No,No,No,No,2,0,600,1,11-01-2018,2018,1,11,January,Q1,2,Thursday,FQ-4
18478389,Die Bí_ckerei,1,India,New Delhi,R K Puram,77.1784867,28.5751601,"Bakery, Desserts",Indian Rupees(Rs.),No,No,No,No,2,0,500,1,20-01-2014,2014,1,20,January,Q1,4,Monday,FQ-4
18265712,New Sethi's,1,India,New Delhi,Lajpat Nagar 1,77.24355239,28.57387443,"Mughlai, North Indian",Indian Rupees(Rs.),No,No,No,No,2,0,500,1,16-12-2013,2013,12,16,December,Q4,51,Monday,FQ-3
18375201,Ashiyan Foods,1,India,New Delhi,Mehrauli,77.1901673,28.5266192,"North Indian, Chinese, Continental",Indian Rupees(Rs.),No,No,No,No,2,0,700,1,17-12-2012,2012,12,17,December,Q4,51,Monday,FQ-3
18419424,Khan Tandoori Hub,1,India,New Delhi,Vasundhara Enclave,77.30728882,28.5915558,"North Indian, Mughlai",Indian Rupees(Rs.),No,No,No,No,2,0,500,1,15-12-2010,2010,12,15,December,Q4,51,Wednesday,FQ-3
18414469,Kasur Khyon,1,India,New Delhi,East of Kailash,77.2460453,28.5590781,"Mughlai, Chinese",Indian Rupees(Rs.),No,No,No,No,2,0,500,1,12-11-2012,2012,11,12,November,Q4,46,Monday,FQ-3
18464637,Spices Affair,1,India,New Delhi,Gujranwala Town,77.1920352,28.698891,"North Indian, Mughlai",Indian Rupees(Rs.),No,No,No,No,2,0,600,1,02-11-2010,2010,11,2,November,Q4,45,Tuesday,FQ-3
18458658,Kamal Chicken,1,India,New Delhi,Kamla Nagar,77.196097,28.6689477,"Mughlai, North Indian",Indian Rupees(Rs.),No,No,No,No,2,0,500,1,22-11-2012,2012,11,22,November,Q4,47,Thursday,FQ-3
18361932,Cake Point,1,India,New Delhi,Mahipalpur,77.1333427,28.5489147,"Bakery, Desserts",Indian Rupees(Rs.),No,Yes,No,No,2,0,600,1,01-11-2018,2018,11,1,November,Q4,44,Thursday,FQ-3
18313112,Taste of India,1,India,New Delhi,Mahipalpur,77.1293709,28.5505165,"North Indian, Mughlai, Chinese",Indian Rupees(Rs.),Yes,No,No,No,3,0,1000,1,06-11-2016,2016,11,6,November,Q4,46,Sunday,FQ-3
18434343,Dada Ka Dhaba,1,India,New Delhi,R K Puram,77.1760606,28.5660557,"North Indian, Mughlai",Indian Rupees(Rs.),No,Yes,No,No,2,0,500,1,24-11-2013,2013,11,24,November,Q4,48,Sunday,FQ-3
18469940,Ovenstory Pizza,1,India,New Delhi,Connaught Place,77.22947,28.637044,"Pizza, Fast Food",Indian Rupees(Rs.),No,Yes,No,No,2,0,500,1,28-10-2011,2011,10,28,October,Q4,44,Friday,FQ-3
18312598,Viya Cupcakery,1,India,New Delhi,East of Kailash,77.2446488,28.5562573,"Bakery, Desserts",Indian Rupees(Rs.),No,No,No,No,2,0,500,1,19-10-2014,2014,10,19,October,Q4,43,Sunday,FQ-3
18261164,DZI House,1,India,New Delhi,Majnu ka Tila,77.2282559,28.701847,"North Indian, Chinese, Tibetan",Indian Rupees(Rs.),No,No,No,No,2,0,550,1,10-10-2013,2013,10,10,October,Q4,41,Thursday,FQ-3
18354996,The Yolmo Kitchen,1,India,New Delhi,Munirka,77.170693,28.5588623,Chinese,Indian Rupees(Rs.),No,No,No,No,2,0,500,1,21-10-2012,2012,10,21,October,Q4,43,Sunday,FQ-3
18440160,Chawla Chik Inn,1,India,New Delhi,Sainik Farms,77.214375,28.507952,"North Indian, Mughlai",Indian Rupees(Rs.),No,Yes,No,No,2,0,800,1,17-10-2016,2016,10,17,October,Q4,43,Monday,FQ-3
18335692,Xpert Bakers,1,India,New Delhi,Anand Vihar,77.3147803,28.6519961,Bakery,Indian Rupees(Rs.),No,No,No,No,1,0,250,1,01-09-2014,2014,9,1,September,Q3,36,Monday,FQ-2
18460325,Javed Chicken Corner,1,India,New Delhi,Kamla Nagar,77.2079014,28.6766471,Mughlai,Indian Rupees(Rs.),No,No,No,No,1,0,400,1,10-09-2010,2010,9,10,September,Q3,37,Friday,FQ-2
18294237,Al-Rihan,1,India,New Delhi,Lajpat Nagar 1,77.24159539,28.57591488,Mughlai,Indian Rupees(Rs.),No,No,No,No,1,0,250,1,03-09-2016,2016,9,3,September,Q3,36,Saturday,FQ-2
18449646,MK's Chinese Food,1,India,New Delhi,Lawrence Road,77.1555845,28.6834348,"Chinese, Fast Food",Indian Rupees(Rs.),No,No,No,No,1,0,250,1,26-09-2016,2016,9,26,September,Q3,40,Monday,FQ-2
18421464,Omi Pizza,1,India,New Delhi,Laxmi Nagar,77.2762533,28.6302238,Fast Food,Indian Rupees(Rs.),No,No,No,No,1,0,350,1,03-09-2010,2010,9,3,September,Q3,36,Friday,FQ-2
18440394,South Indian & Chinese Fast Food,1,India,New Delhi,Laxmi Nagar,77.2777733,28.6302006,"South Indian, Chinese, Fast Food",Indian Rupees(Rs.),No,No,No,No,1,0,350,1,26-09-2014,2014,9,26,September,Q3,39,Friday,FQ-2
18489804,Vandana Food Corner,1,India,New Delhi,MG Road,77.1457079,28.4946506,"Fast Food, North Indian, South Indian",Indian Rupees(Rs.),No,No,No,No,1,0,150,1,26-09-2014,2014,9,26,September,Q3,39,Friday,FQ-2
18425772,King Of Roll,1,India,New Delhi,Munirka,77.1719215,28.5564964,Fast Food,Indian Rupees(Rs.),No,No,No,No,1,0,100,1,20-09-2011,2011,9,20,September,Q3,39,Tuesday,FQ-2
9173,Jyoti Sweets,1,India,New Delhi,Nangloi,77.0625067,28.6761455,Mithai,Indian Rupees(Rs.),No,No,No,No,1,0,100,1,07-09-2010,2010,9,7,September,Q3,37,Tuesday,FQ-2
18466389,Shahi Chicken Biryani Corner,1,India,New Delhi,Nangloi,77.08171561,28.69252378,Biryani,Indian Rupees(Rs.),No,No,No,No,1,0,250,1,17-09-2011,2011,9,17,September,Q3,38,Saturday,FQ-2
18434504,Monis Kada Hotel,1,India,New Delhi,Nizamuddin,77.2440626,28.591272,Mughlai,Indian Rupees(Rs.),No,No,No,No,1,0,400,1,15-09-2010,2010,9,15,September,Q3,38,Wednesday,FQ-2
18396418,Cake Spot,1,India,New Delhi,Sarojini Nagar,77.1939753,28.5696602,"Bakery, Fast Food",Indian Rupees(Rs.),No,No,No,No,1,0,400,1,24-09-2018,2018,9,24,September,Q3,39,Monday,FQ-2
18438465,Rajesh Eating Corner,1,India,New Delhi,Shakarpur,77.2788374,28.6282443,Street Food,Indian Rupees(Rs.),No,No,No,No,1,0,150,1,07-09-2011,2011,9,7,September,Q3,37,Wednesday,FQ-2
18492045,Ching Chinese,1,India,New Delhi,Subhash Nagar,77.113421,28.6380416,"Chinese, Fast Food",Indian Rupees(Rs.),No,No,No,No,1,0,400,1,25-09-2010,2010,9,25,September,Q3,39,Saturday,FQ-2
18292478,Dolce Gelato,1,India,New Delhi,Tagore Garden,77.1064709,28.6423312,Ice Cream,Indian Rupees(Rs.),No,No,No,No,1,0,120,1,01-09-2013,2013,9,1,September,Q3,36,Sunday,FQ-2
18227685,Anthony's Kitchen,1,India,New Delhi,Vasant Vihar,77.16367822,28.55747579,"North Indian, South Indian",Indian Rupees(Rs.),No,No,No,No,1,0,250,1,16-09-2016,2016,9,16,September,Q3,38,Friday,FQ-2
18420697,Aggarwal Sweets,1,India,New Delhi,Vasundhara Enclave,77.3143328,28.6017649,Desserts,Indian Rupees(Rs.),No,No,No,No,1,0,150,1,11-09-2013,2013,9,11,September,Q3,37,Wednesday,FQ-2
18424188,Special Chicken Biryani,1,India,New Delhi,Vasundhara Enclave,77.30622523,28.5890367,Biryani,Indian Rupees(Rs.),No,No,No,No,1,0,100,1,02-09-2015,2015,9,2,September,Q3,36,Wednesday,FQ-2
18421467,Momos Hi Momos,1,India,New Delhi,Vivek Vihar,77.31812015,28.67132945,Chinese,Indian Rupees(Rs.),No,No,No,No,1,0,150,1,07-09-2014,2014,9,7,September,Q3,37,Sunday,FQ-2
18424867,Hot Pot,1,India,New Delhi,Civil Lines,77.2213398,28.7008282,Chinese,Indian Rupees(Rs.),No,No,No,No,1,0,150,1,22-08-2012,2012,8,22,August,Q3,34,Wednesday,FQ-2
18472675,Kolkatta Kathi Roll,1,India,New Delhi,Defence Colony,77.2286152,28.5740273,"North Indian, Fast Food",Indian Rupees(Rs.),No,No,No,No,1,0,150,1,24-08-2012,2012,8,24,August,Q3,34,Friday,FQ-2
18481294,Krishna Juice & Shakes Corner,1,India,New Delhi,Green Park,77.2097034,28.560101,Juices,Indian Rupees(Rs.),No,No,No,No,1,0,100,1,04-08-2018,2018,8,4,August,Q3,31,Saturday,FQ-2
18432941,Daya Sagar,1,India,New Delhi,IP Extension,77.2974464,28.6346331,"North Indian, Chinese, Mughlai",Indian Rupees(Rs.),No,No,No,No,1,0,400,1,19-08-2015,2015,8,19,August,Q3,34,Wednesday,FQ-2
18414511,JD's Restaurant,1,India,New Delhi,Mahipalpur,77.1281314,28.5470234,"North Indian, Chinese",Indian Rupees(Rs.),No,No,No,No,1,0,350,1,22-08-2015,2015,8,22,August,Q3,34,Saturday,FQ-2
18357534,Malabar Style Kitchen,1,India,New Delhi,Mahipalpur,77.1249279,28.5429013,Kerala,Indian Rupees(Rs.),No,No,No,No,1,0,350,1,01-08-2014,2014,8,1,August,Q3,31,Friday,FQ-2
18471263,Hans's Planet-F,1,India,New Delhi,Najafgarh,77.0025685,28.5605204,"Chinese, Fast Food, North Indian",Indian Rupees(Rs.),No,No,No,No,1,0,350,1,17-08-2015,2015,8,17,August,Q3,34,Monday,FQ-2
18398504,Aggarwal Bikaneri Sweets,1,India,New Delhi,Naraina,77.14808,28.6322418,Mithai,Indian Rupees(Rs.),No,No,No,No,1,0,100,1,23-08-2011,2011,8,23,August,Q3,35,Tuesday,FQ-2
18371399,Bengali Restaurant,1,India,New Delhi,Naraina,77.1358184,28.6223489,"Bengali, Chinese",Indian Rupees(Rs.),No,No,No,No,1,0,150,1,27-08-2014,2014,8,27,August,Q3,35,Wednesday,FQ-2
18429186,Shahi Hyderbadi Biryani,1,India,New Delhi,Naraina,77.1363776,28.6213659,Mughlai,Indian Rupees(Rs.),No,No,No,No,1,0,250,1,11-08-2010,2010,8,11,August,Q3,33,Wednesday,FQ-2
18406823,Momozone,1,India,New Delhi,Palam,77.076292,28.6069426,Fast Food,Indian Rupees(Rs.),No,No,No,No,1,0,150,1,15-08-2012,2012,8,15,August,Q3,33,Wednesday,FQ-2
18440169,Foodizm,1,India,New Delhi,Pandav Nagar,77.2858165,28.6192264,"North Indian, Chinese",Indian Rupees(Rs.),No,No,No,No,1,0,250,1,01-08-2015,2015,8,1,August,Q3,31,Saturday,FQ-2
18435210,Kanuchawala,1,India,New Delhi,Prashant Vihar,77.1371188,28.7132323,"North Indian, Chinese",Indian Rupees(Rs.),No,No,No,No,1,0,400,1,19-08-2012,2012,8,19,August,Q3,34,Sunday,FQ-2
18486857,Vaishanavi Food Store,1,India,New Delhi,R K Puram,77.1740838,28.5768003,"North Indian, Fast Food",Indian Rupees(Rs.),No,No,No,No,1,0,150,1,22-08-2017,2017,8,22,August,Q3,34,Tuesday,FQ-2
18409190,PSR Foods,1,India,New Delhi,Saket,77.19821937,28.51756924,"North Indian, Street Food",Indian Rupees(Rs.),No,No,No,No,1,0,100,1,14-08-2014,2014,8,14,August,Q3,33,Thursday,FQ-2
18438438,Aggarwal Bikaner Sweets,1,India,New Delhi,Shakarpur,77.2798705,28.6270083,Bakery,Indian Rupees(Rs.),No,No,No,No,1,0,250,1,14-08-2018,2018,8,14,August,Q3,33,Tuesday,FQ-2
18175302,7 Colours Xpress Kitchen,1,India,New Delhi,South Extension 1,77.2249885,28.5683377,"Chinese, North Indian",Indian Rupees(Rs.),No,No,No,No,1,0,350,1,14-08-2010,2010,8,14,August,Q3,33,Saturday,FQ-2
18377909,Food Plaza,1,India,New Delhi,Vasundhara Enclave,77.3222402,28.6013619,"Chinese, Fast Food",Indian Rupees(Rs.),No,No,No,No,1,0,250,1,21-08-2018,2018,8,21,August,Q3,34,Tuesday,FQ-2
18449640,Shree Krishna Dhaba,1,India,New Delhi,Daryaganj,77.2400961,28.6477718,"North Indian, South Indian",Indian Rupees(Rs.),No,No,No,No,1,0,100,1,21-07-2016,2016,7,21,July,Q3,30,Thursday,FQ-2
18435819,Dada Ka,1,India,New Delhi,Dilshad Garden,77.3200498,28.6806456,"Mughlai, Chinese",Indian Rupees(Rs.),No,No,No,No,1,0,250,1,06-07-2017,2017,7,6,July,Q3,27,Thursday,FQ-2
18361741,Noddy's,1,India,New Delhi,Gujranwala Town,77.1920054,28.6982616,"Beverages, Desserts",Indian Rupees(Rs.),No,No,No,No,1,0,100,1,03-07-2012,2012,7,3,July,Q3,27,Tuesday,FQ-2
18424643,Asian House Restaurant,1,India,New Delhi,Majnu ka Tila,77.2280763,28.7008446,"Tibetan, South Indian, North Indian",Indian Rupees(Rs.),No,No,No,No,1,0,400,1,01-07-2013,2013,7,1,July,Q3,27,Monday,FQ-2
309101,Kullu Manali Restaurant,1,India,New Delhi,Majnu ka Tila,77.227717,28.7014373,"Tibetan, Chinese, North Indian",Indian Rupees(Rs.),No,No,No,No,1,0,400,1,25-07-2013,2013,7,25,July,Q3,30,Thursday,FQ-2
18272376,Tandoori Khazana,1,India,New Delhi,Majnu ka Tila,77.2276272,28.70116,"North Indian, Fast Food",Indian Rupees(Rs.),No,No,No,No,1,0,350,1,05-07-2014,2014,7,5,July,Q3,27,Saturday,FQ-2
18317329,Desi Chulha,1,India,New Delhi,Mayur Vihar Phase 1,77.2958351,28.6097862,"North Indian, Chinese",Indian Rupees(Rs.),No,No,No,No,1,0,400,1,17-07-2016,2016,7,17,July,Q3,30,Sunday,FQ-2
18363044,Bikaner Sweets Chaat cafe,1,India,New Delhi,Mukherjee Nagar,77.2184653,28.7092739,"Mithai, Street Food",Indian Rupees(Rs.),No,No,No,No,1,0,100,1,26-07-2015,2015,7,26,July,Q3,31,Sunday,FQ-2
18421461,Spl. Flavour Sodas & Fruit shakes,1,India,New Delhi,Mukherjee Nagar,77.208094,28.7102514,Juices,Indian Rupees(Rs.),No,No,No,No,1,0,100,1,20-07-2016,2016,7,20,July,Q3,30,Wednesday,FQ-2
18432214,Dilli Darbar Chicken Point,1,India,New Delhi,Najafgarh,76.9935221,28.5906017,Mughlai,Indian Rupees(Rs.),No,No,No,No,1,0,400,1,09-07-2018,2018,7,9,July,Q3,28,Monday,FQ-2
304405,Sharma Sweets,1,India,New Delhi,Najafgarh,76.9838181,28.6169779,"Mithai, Street Food",Indian Rupees(Rs.),No,No,No,No,1,0,100,1,02-07-2013,2013,7,2,July,Q3,27,Tuesday,FQ-2
18464636,Baba Ji,1,India,New Delhi,Nangloi,77.06540443,28.67897397,Fast Food,Indian Rupees(Rs.),No,No,No,No,1,0,250,1,22-07-2010,2010,7,22,July,Q3,30,Thursday,FQ-2
18431187,Foodies,1,India,New Delhi,Naraina,77.1362918,28.6220182,Chinese,Indian Rupees(Rs.),No,No,No,No,1,0,400,1,03-07-2011,2011,7,3,July,Q3,28,Sunday,FQ-2
18431105,Surprise - Bakers & Bites,1,India,New Delhi,Palam,77.0847547,28.5962898,"Bakery, Fast Food",Indian Rupees(Rs.),No,No,No,No,1,0,400,1,08-07-2014,2014,7,8,July,Q3,28,Tuesday,FQ-2
18432030,Angelena Restaurant,1,India,New Delhi,Pandav Nagar,77.2847393,28.6213874,"North Indian, Chinese",Indian Rupees(Rs.),No,No,No,No,1,0,350,1,17-07-2015,2015,7,17,July,Q3,29,Friday,FQ-2
18363081,3x Cafe,1,India,New Delhi,Pitampura,77.1355204,28.7085129,"Fast Food, Desserts, Beverages",Indian Rupees(Rs.),No,No,No,No,1,0,450,1,02-07-2012,2012,7,2,July,Q3,27,Monday,FQ-2
18441685,R.S. Chinese Food,1,India,New Delhi,Preet Vihar,77.2909771,28.6342674,Fast Food,Indian Rupees(Rs.),No,No,No,No,1,0,250,1,09-07-2014,2014,7,9,July,Q3,28,Wednesday,FQ-2
7809,Welcome Fast Food & Parantha,1,India,New Delhi,Qutab Institutional Area,77.1856278,28.542264,"Chinese, Fast Food",Indian Rupees(Rs.),No,No,No,No,1,0,100,1,19-07-2017,2017,7,19,July,Q3,29,Wednesday,FQ-2
18445764,Shalimar Vyanjan,1,India,New Delhi,Shalimar Bagh,77.1628082,28.7062081,"North Indian, Chinese",Indian Rupees(Rs.),No,No,No,No,1,0,400,1,24-07-2016,2016,7,24,July,Q3,31,Sunday,FQ-2
18431145,Radha Swami Chaat Bhandar,1,India,New Delhi,Subhash Nagar,77.1055921,28.6392123,Street Food,Indian Rupees(Rs.),No,No,No,No,1,0,100,1,21-07-2018,2018,7,21,July,Q3,29,Saturday,FQ-2
18455551,Variety of Shawarmas,1,India,New Delhi,Subhash Nagar,77.1128304,28.6382092,Fast Food,Indian Rupees(Rs.),No,No,No,No,1,0,150,1,02-07-2017,2017,7,2,July,Q3,27,Sunday,FQ-2
18372694,Sweets n Treats,1,India,New Delhi,Vasundhara Enclave,77.3068428,28.59118048,Street Food,Indian Rupees(Rs.),No,No,No,No,1,0,50,1,23-07-2013,2013,7,23,July,Q3,30,Tuesday,FQ-2
18168147,S.K. Fast Food,1,India,New Delhi,Zakir Nagar,77.28382677,28.56618897,Chinese,Indian Rupees(Rs.),No,No,No,No,1,0,350,1,03-07-2011,2011,7,3,July,Q3,28,Sunday,FQ-2
18401128,Aahar Meat and Chicken Shop,1,India,New Delhi,Alaknanda,77.25,28.52,"Raw Meats, Fast Food",Indian Rupees(Rs.),No,No,No,No,1,0,400,1,08-06-2018,2018,6,8,June,Q2,23,Friday,FQ-1
18421463,Madaan Confectionery,1,India,New Delhi,Anand Vihar,77.3180203,28.6636866,Bakery,Indian Rupees(Rs.),No,No,No,No,1,0,150,1,11-06-2016,2016,6,11,June,Q2,24,Saturday,FQ-1
18395538,Matthi Wala,1,India,New Delhi,Ashok Vihar Phase 1,77.18,28.67,"Mithai, Street Food",Indian Rupees(Rs.),No,No,No,No,1,0,150,1,26-06-2017,2017,6,26,June,Q2,26,Monday,FQ-1
18351471,Khan Foods,1,India,New Delhi,Daryaganj,77.24033283,28.6439042,Mughlai,Indian Rupees(Rs.),No,No,No,No,1,0,400,1,23-06-2018,2018,6,23,June,Q2,25,Saturday,FQ-1
18426904,Preet Fast Foods,1,India,New Delhi,Delhi University-GTB Nagar,77.2052605,28.7014404,Street Food,Indian Rupees(Rs.),No,No,No,No,1,0,50,1,17-06-2012,2012,6,17,June,Q2,25,Sunday,FQ-1
18424625,Kathi Junction,1,India,New Delhi,Dilshad Garden,77.3180387,28.6806468,Fast Food,Indian Rupees(Rs.),No,No,No,No,1,0,250,1,16-06-2014,2014,6,16,June,Q2,25,Monday,FQ-1
18419919,Maan Singh Halwai,1,India,New Delhi,Jangpura,77.258251,28.5792658,Mithai,Indian Rupees(Rs.),No,No,No,No,1,0,100,1,28-06-2011,2011,6,28,June,Q2,27,Tuesday,FQ-1
18394362,Connoisseur,1,India,New Delhi,Janpath,77.20999705,28.62569483,Bakery,Indian Rupees(Rs.),No,No,No,No,1,0,400,1,24-06-2013,2013,6,24,June,Q2,26,Monday,FQ-1
18261956,Goldy Chat Bhandar,1,India,New Delhi,Krishna Nagar,77.28,28.66,Street Food,Indian Rupees(Rs.),No,No,No,No,1,0,100,1,15-06-2017,2017,6,15,June,Q2,24,Thursday,FQ-1
302473,Cafe Highway,1,India,New Delhi,Mahipalpur,77.1077373,28.5332421,"Fast Food, Chinese",Indian Rupees(Rs.),No,No,No,No,1,0,250,1,19-06-2014,2014,6,19,June,Q2,25,Thursday,FQ-1
18478990,Bhutani Chaap,1,India,New Delhi,Mehrauli,77.1818486,28.5222296,"North Indian, Fast Food",Indian Rupees(Rs.),No,No,No,No,1,0,250,1,20-06-2018,2018,6,20,June,Q2,25,Wednesday,FQ-1
18449629,Giani,1,India,New Delhi,Moti Nagar,77.1422037,28.6576022,"Ice Cream, Desserts",Indian Rupees(Rs.),No,No,No,No,1,0,400,1,17-06-2018,2018,6,17,June,Q2,25,Sunday,FQ-1
18361211,Prem Chinese Fast Food,1,India,New Delhi,Najafgarh,76.9654941,28.6090439,Chinese,Indian Rupees(Rs.),No,No,No,No,1,0,150,1,24-06-2011,2011,6,24,June,Q2,26,Friday,FQ-1
18358168,Sam's 22,1,India,New Delhi,Okhla Phase 1,77.28724223,28.50129443,"Fast Food, Beverages",Indian Rupees(Rs.),No,No,No,No,1,0,250,1,05-06-2013,2013,6,5,June,Q2,23,Wednesday,FQ-1
18440163,Zaika Restaurant,1,India,New Delhi,Pandav Nagar,77.280266,28.6193685,"Mughlai, North Indian",Indian Rupees(Rs.),No,No,No,No,1,0,350,1,25-06-2016,2016,6,25,June,Q2,26,Saturday,FQ-1
18489533,Bhawani Restaurant,1,India,New Delhi,Sainik Farms,77.2058841,28.51673,"North Indian, Mughlai, Chinese",Indian Rupees(Rs.),No,No,No,No,1,0,350,1,23-06-2014,2014,6,23,June,Q2,26,Monday,FQ-1
18424654,New Aggarwal Sweets & Fast Food,1,India,New Delhi,Vasundhara Enclave,77.3067747,28.5900965,"Mithai, Fast Food",Indian Rupees(Rs.),No,No,No,No,1,0,150,1,01-06-2013,2013,6,1,June,Q2,22,Saturday,FQ-1
18466972,HTW Bakers,1,India,New Delhi,Zakir Nagar,77.27981217,28.56744249,"Bakery, Desserts",Indian Rupees(Rs.),No,No,No,No,1,0,350,1,18-06-2014,2014,6,18,June,Q2,25,Wednesday,FQ-1
18466396,Dessi Food,1,India,New Delhi,Chandni Chowk,77.2319961,28.6574304,Street Food,Indian Rupees(Rs.),No,No,No,No,1,0,100,1,09-05-2017,2017,5,9,May,Q2,19,Tuesday,FQ-1
18435806,Crazzy Bite,1,India,New Delhi,Dilshad Garden,77.3243518,28.6869556,Chinese,Indian Rupees(Rs.),No,No,No,No,1,0,400,1,12-05-2016,2016,5,12,May,Q2,20,Thursday,FQ-1
18435303,Punjabi Tandoori Tikka,1,India,New Delhi,Geeta Colony,77.2765693,28.6509197,Street Food,Indian Rupees(Rs.),No,No,No,No,1,0,250,1,22-05-2017,2017,5,22,May,Q2,21,Monday,FQ-1
18168122,Kerala Kitchen & Restaurant,1,India,New Delhi,Mehrauli,77.1937384,28.527825,South Indian,Indian Rupees(Rs.),No,No,No,No,1,0,250,1,18-05-2011,2011,5,18,May,Q2,21,Wednesday,FQ-1
18489541,Aggarwal Sweets,1,India,New Delhi,MG Road,77.1459577,28.493198,"Mithai, South Indian, Street Food",Indian Rupees(Rs.),No,No,No,No,1,0,250,1,19-05-2015,2015,5,19,May,Q2,21,Tuesday,FQ-1
18451166,Magic Mo:Mo Corner,1,India,New Delhi,Moti Nagar,77.1419683,28.6582366,"Chinese, Fast Food",Indian Rupees(Rs.),No,No,No,No,1,0,250,1,15-05-2016,2016,5,15,May,Q2,21,Sunday,FQ-1
310952,Student Corner,1,India,New Delhi,Mukherjee Nagar,77.2188247,28.7091854,Fast Food,Indian Rupees(Rs.),No,No,No,No,1,0,50,1,24-05-2010,2010,5,24,May,Q2,22,Monday,FQ-1
18468524,The Pure Kitchen,1,India,New Delhi,Munirka,77.1901673,28.5266192,"Chinese, Continental, North Indian",Indian Rupees(Rs.),No,No,No,No,1,0,250,1,27-05-2016,2016,5,27,May,Q2,22,Friday,FQ-1
9194,Do Bhai Paneer Wale And Sweets,1,India,New Delhi,Nangloi,77.0662951,28.6801056,Bakery,Indian Rupees(Rs.),No,No,No,No,1,0,100,1,22-05-2011,2011,5,22,May,Q2,22,Sunday,FQ-1
18371391,TCW Chaat Point,1,India,New Delhi,Nangloi,77.0642756,28.6779685,Street Food,Indian Rupees(Rs.),No,No,No,No,1,0,100,1,10-05-2015,2015,5,10,May,Q2,20,Sunday,FQ-1
18421038,Cafe Coffee Day,1,India,New Delhi,Qutab Institutional Area,77.181133,28.537381,Cafe,Indian Rupees(Rs.),No,No,No,No,1,0,450,1,28-05-2012,2012,5,28,May,Q2,22,Monday,FQ-1
18412894,Cake Walk,1,India,New Delhi,Qutab Institutional Area,77.1855515,28.5408514,"Bakery, Fast Food",Indian Rupees(Rs.),No,No,No,No,1,0,100,1,01-05-2017,2017,5,1,May,Q2,18,Monday,FQ-1
18423857,Laxmi Dairy,1,India,New Delhi,Shahdara,77.2939837,28.6893847,"Mithai, Street Food",Indian Rupees(Rs.),No,No,No,No,1,0,150,1,04-05-2013,2013,5,4,May,Q2,18,Saturday,FQ-1
18291209,Raju Ice Cream Parlor,1,India,New Delhi,Shakarpur,77.2774778,28.6307758,"Pizza, Ice Cream",Indian Rupees(Rs.),No,No,No,No,1,0,250,1,21-05-2017,2017,5,21,May,Q2,21,Sunday,FQ-1
18420433,Shisha,1,India,New Delhi,East Patel Nagar,77.1738594,28.6447299,Cafe,Indian Rupees(Rs.),No,No,No,No,1,0,400,1,14-04-2013,2013,4,14,April,Q2,16,Sunday,FQ-1
18336472,Brown House Cafe,1,India,New Delhi,Hauz Khas,77.2099284,28.5600874,"Chinese, North Indian",Indian Rupees(Rs.),No,No,No,No,1,0,250,1,16-04-2011,2011,4,16,April,Q2,16,Saturday,FQ-1
18419915,Daawat-e-Mehak,1,India,New Delhi,Jangpura,77.262305,28.5764607,"North Indian, Mughlai, Chinese",Indian Rupees(Rs.),No,No,No,No,1,0,350,1,04-04-2012,2012,4,4,April,Q2,14,Wednesday,FQ-1
18416842,U.P. Al-Flah Restaurant,1,India,New Delhi,Mahipalpur,77.1252807,28.5457776,Biryani,Indian Rupees(Rs.),No,No,No,No,1,0,350,1,04-04-2011,2011,4,4,April,Q2,15,Monday,FQ-1
18492029,Aap Ki Khatir,1,India,New Delhi,MG Road,77.1482134,28.4932341,"Mughlai, North Indian",Indian Rupees(Rs.),No,No,No,No,1,0,400,1,05-04-2011,2011,4,5,April,Q2,15,Tuesday,FQ-1
18352672,Bollywood Khana,1,India,New Delhi,MG Road,77.1257624,28.4798478,"North Indian, Fast Food",Indian Rupees(Rs.),No,No,No,No,1,0,150,1,22-04-2017,2017,4,22,April,Q2,16,Saturday,FQ-1
18492033,Lajawab Chicken & Fish Fry,1,India,New Delhi,MG Road,77.1465358,28.4925721,Mughlai,Indian Rupees(Rs.),No,No,No,No,1,0,350,1,15-04-2018,2018,4,15,April,Q2,16,Sunday,FQ-1
18472683,Shree Vinayaga Restaurant,1,India,New Delhi,Munirka,77.1742272,28.5560668,South Indian,Indian Rupees(Rs.),No,No,No,No,1,0,400,1,28-04-2015,2015,4,28,April,Q2,18,Tuesday,FQ-1
306678,Bajrang Misthan Bhawan,1,India,New Delhi,Najafgarh,76.9869396,28.6053412,Mithai,Indian Rupees(Rs.),No,No,No,No,1,0,100,1,24-04-2014,2014,4,24,April,Q2,17,Thursday,FQ-1
18359302,Chilli Tadka,1,India,New Delhi,Najafgarh,77.0003579,28.6315566,"Chinese, Fast Food",Indian Rupees(Rs.),No,No,No,No,1,0,250,1,02-04-2016,2016,4,2,April,Q2,14,Saturday,FQ-1
18352275,King's Food,1,India,New Delhi,Najafgarh,76.9736469,28.6159872,Chinese,Indian Rupees(Rs.),No,No,No,No,1,0,250,1,25-04-2011,2011,4,25,April,Q2,18,Monday,FQ-1
18322599,Daily Belly,1,India,New Delhi,Nangloi,77.0408396,28.6821182,"North Indian, South Indian, Chinese",Indian Rupees(Rs.),No,No,No,No,1,0,350,1,08-04-2016,2016,4,8,April,Q2,15,Friday,FQ-1
304888,Dosa and Pizza Corner,1,India,New Delhi,Nangloi,77.0690832,28.6833297,"South Indian, Pizza, Chinese",Indian Rupees(Rs.),No,No,No,No,1,0,150,1,19-04-2013,2013,4,19,April,Q2,16,Friday,FQ-1
18372324,Kasba,1,India,New Delhi,Palam,77.0917506,28.5861677,Chinese,Indian Rupees(Rs.),No,No,No,No,1,0,250,1,06-04-2017,2017,4,6,April,Q2,14,Thursday,FQ-1
18361222,Dinesh Meat Wala,1,India,New Delhi,Pitampura,77.1437283,28.7100972,Mughlai,Indian Rupees(Rs.),No,No,No,No,1,0,400,1,10-04-2010,2010,4,10,April,Q2,15,Saturday,FQ-1
18357943,Shama Muradabadi Chicken Biryani,1,India,New Delhi,Sarita Vihar,77.2990585,28.5334587,Mughlai,Indian Rupees(Rs.),No,No,No,No,1,0,400,1,08-04-2018,2018,4,8,April,Q2,15,Sunday,FQ-1
18365986,Batra Chinese Food & Chaap,1,India,New Delhi,Subhash Nagar,77.111493,28.6341831,Chinese,Indian Rupees(Rs.),No,No,No,No,1,0,250,1,21-04-2013,2013,4,21,April,Q2,17,Sunday,FQ-1
18455545,Freezy,1,India,New Delhi,Subhash Nagar,77.1184103,28.6351694,Ice Cream,Indian Rupees(Rs.),No,No,No,No,1,0,50,1,13-04-2017,2017,4,13,April,Q2,15,Thursday,FQ-1
18366008,Madan Sweets & Bakers,1,India,New Delhi,Subhash Nagar,77.1181788,28.6360349,Mithai,Indian Rupees(Rs.),No,No,No,No,1,0,100,1,02-04-2016,2016,4,2,April,Q2,14,Saturday,FQ-1
18291232,Unique Pastry,1,India,New Delhi,Vivek Vihar,77.31820431,28.67148683,"Bakery, Desserts",Indian Rupees(Rs.),No,No,No,No,1,0,250,1,19-04-2018,2018,4,19,April,Q2,16,Thursday,FQ-1
18378043,Hot N Fresh Pizza,1,India,New Delhi,Dilshad Garden,77.3179939,28.6806874,Pizza,Indian Rupees(Rs.),No,No,No,No,1,0,400,1,24-03-2010,2010,3,24,March,Q1,13,Wednesday,FQ-4
18463985,RAM-G Samose Wale,1,India,New Delhi,GTB Nagar,77.2045178,28.6961124,Street Food,Indian Rupees(Rs.),No,No,No,No,1,0,100,1,03-03-2018,2018,3,3,March,Q1,9,Saturday,FQ-4
18391757,Good Luck Cafe,1,India,New Delhi,Majnu ka Tila,77.2287499,28.7024763,Ice Cream,Indian Rupees(Rs.),No,No,No,No,1,0,250,1,24-03-2012,2012,3,24,March,Q1,12,Saturday,FQ-4
310988,Special Tea Point,1,India,New Delhi,Mukherjee Nagar,77.2188247,28.709454,"Street Food, North Indian",Indian Rupees(Rs.),No,No,No,No,1,0,50,1,16-03-2015,2015,3,16,March,Q1,12,Monday,FQ-4
18425768,S.R. Bakers,1,India,New Delhi,Munirka,77.1718111,28.5568164,Bakery,Indian Rupees(Rs.),No,No,No,No,1,0,100,1,19-03-2017,2017,3,19,March,Q1,12,Sunday,FQ-4
18432222,Anjel China & Tibetian Food,1,India,New Delhi,Najafgarh,77.0024495,28.5607897,"Tibetan, Chinese",Indian Rupees(Rs.),No,No,No,No,1,0,400,1,21-03-2014,2014,3,21,March,Q1,12,Friday,FQ-4
18261161,The Regal Chicken Corner,1,India,New Delhi,Nangloi,77.0626796,28.6763063,"North Indian, Mughlai",Indian Rupees(Rs.),No,No,No,No,1,0,400,1,11-03-2014,2014,3,11,March,Q1,11,Tuesday,FQ-4
18368023,Guru Om Vanna,1,India,New Delhi,Rajendra Place,77.1773576,28.6444387,Street Food,Indian Rupees(Rs.),No,No,No,No,1,0,400,1,15-03-2015,2015,3,15,March,Q1,12,Sunday,FQ-4
18291456,Kedgy Bite,1,India,New Delhi,Subhash Nagar,77.105132,28.6407295,Fast Food,Indian Rupees(Rs.),No,No,No,No,1,0,100,1,27-03-2016,2016,3,27,March,Q1,14,Sunday,FQ-4
18354667,Food Cafe,1,India,New Delhi,Alaknanda,77.25012012,28.5299095,"South Indian, North Indian, Chinese",Indian Rupees(Rs.),No,No,No,No,1,0,350,1,12-02-2016,2016,2,12,February,Q1,7,Friday,FQ-4
18421693,Cookie Shookie,1,India,New Delhi,Anand Vihar,77.3068421,28.6594206,Bakery,Indian Rupees(Rs.),No,No,No,No,1,0,100,1,09-02-2010,2010,2,9,February,Q1,7,Tuesday,FQ-4
18458325,VadaPav 'n' Frankie,1,India,New Delhi,Ashok Vihar Phase 1,77.1732301,28.6873126,Fast Food,Indian Rupees(Rs.),No,No,No,No,1,0,100,1,05-02-2013,2013,2,5,February,Q1,6,Tuesday,FQ-4
18382583,Makers & Bakers,1,India,New Delhi,Barakhamba Road,77.2243937,28.6337562,"Bakery, Desserts",Indian Rupees(Rs.),No,No,No,No,1,0,350,1,13-02-2012,2012,2,13,February,Q1,7,Monday,FQ-4
18261146,Hind Bakery & Chinese Fast Food,1,India,New Delhi,Civil Lines,77.2222477,28.7028124,Fast Food,Indian Rupees(Rs.),No,No,No,No,1,0,150,1,12-02-2016,2016,2,12,February,Q1,7,Friday,FQ-4
18355127,Muradabadi Shahi Biryani & Chicken Corner,1,India,New Delhi,Defence Colony,77.2286152,28.5741169,Mughlai,Indian Rupees(Rs.),No,No,No,No,1,0,400,1,17-02-2017,2017,2,17,February,Q1,7,Friday,FQ-4
18441698,Nice Food Corner,1,India,New Delhi,IP Extension,77.2934576,28.6219398,Street Food,Indian Rupees(Rs.),No,No,No,No,1,0,150,1,22-02-2014,2014,2,22,February,Q1,8,Saturday,FQ-4
18222598,Murliwala Bakers,1,India,New Delhi,Krishna Nagar,77.285269,28.651044,"Bakery, Fast Food",Indian Rupees(Rs.),No,No,No,No,1,0,250,1,22-02-2015,2015,2,22,February,Q1,9,Sunday,FQ-4
305181,Aakash Sweets & Caterers,1,India,New Delhi,Mahipalpur,77.1242919,28.5434422,"Mithai, Street Food",Indian Rupees(Rs.),No,No,No,No,1,0,150,1,15-02-2010,2010,2,15,February,Q1,8,Monday,FQ-4
18451158,Hungerz Hub,1,India,New Delhi,Moti Nagar,77.1389966,28.6594736,"Burger, Pizza, Fast Food",Indian Rupees(Rs.),No,No,No,No,1,0,250,1,19-02-2011,2011,2,19,February,Q1,8,Saturday,FQ-4
18430900,Lounge Bakery,1,India,New Delhi,Najafgarh,77.0006609,28.5910291,Bakery,Indian Rupees(Rs.),No,No,No,No,1,0,400,1,05-02-2011,2011,2,5,February,Q1,6,Saturday,FQ-4
18435332,Bikaner Sweets & Restaurant,1,India,New Delhi,Nangloi,77.0820767,28.6927975,"Mithai, Street Food, North Indian",Indian Rupees(Rs.),No,No,No,No,1,0,450,1,01-02-2015,2015,2,1,February,Q1,6,Sunday,FQ-4
18464640,The Pizza Family,1,India,New Delhi,Nangloi,77.06413608,28.67799829,Pizza,Indian Rupees(Rs.),No,No,No,No,1,0,350,1,19-02-2013,2013,2,19,February,Q1,8,Tuesday,FQ-4
18369770,Paras Corner,1,India,New Delhi,Naraina,77.1468595,28.6314962,Chinese,Indian Rupees(Rs.),No,No,No,No,1,0,150,1,27-02-2015,2015,2,27,February,Q1,9,Friday,FQ-4
18435322,Red Rose Restaurant,1,India,New Delhi,Narela,77.0880292,28.85192847,Fast Food,Indian Rupees(Rs.),No,No,No,No,1,0,450,1,08-02-2018,2018,2,8,February,Q1,6,Thursday,FQ-4
18431173,Kairi The Royal Taste,1,India,New Delhi,Palam,77.083122,28.6093193,"North Indian, South Indian, Chinese",Indian Rupees(Rs.),No,No,No,No,1,0,400,1,24-02-2010,2010,2,24,February,Q1,9,Wednesday,FQ-4
18359282,Chinese Tadka,1,India,New Delhi,Pitampura,77.1426944,28.7064856,Chinese,Indian Rupees(Rs.),No,No,No,No,1,0,250,1,22-02-2018,2018,2,22,February,Q1,8,Thursday,FQ-4
18312459,Pandey Ji Restaurant,1,India,New Delhi,Qutab Institutional Area,77.18608741,28.54186954,"North Indian, Chinese",Indian Rupees(Rs.),No,No,No,No,1,0,150,1,13-02-2017,2017,2,13,February,Q1,7,Monday,FQ-4
18303708,Spice Treat,1,India,New Delhi,Sainik Farms,77.19935864,28.51725461,Chinese,Indian Rupees(Rs.),No,No,No,No,1,0,250,1,10-02-2018,2018,2,10,February,Q1,6,Saturday,FQ-4
18441706,Himalaya Momos,1,India,New Delhi,Shakarpur,77.2819954,28.6322406,Fast Food,Indian Rupees(Rs.),No,No,No,No,1,0,250,1,28-02-2018,2018,2,28,February,Q1,9,Wednesday,FQ-4
18441700,Uttranchal Eating Point,1,India,New Delhi,Shakarpur,77.280183,28.6263812,"North Indian, Chinese, Fast Food",Indian Rupees(Rs.),No,No,No,No,1,0,250,1,27-02-2016,2016,2,27,February,Q1,9,Saturday,FQ-4
18424582,Meatwale.com,1,India,New Delhi,Vasundhara Enclave,77.32050229,28.60012224,Raw Meats,Indian Rupees(Rs.),No,No,No,No,1,0,150,1,02-02-2010,2010,2,2,February,Q1,6,Tuesday,FQ-4
18424192,Zaika Chicken Corner,1,India,New Delhi,Vasundhara Enclave,77.3080954,28.58927604,"Biryani, North Indian",Indian Rupees(Rs.),No,No,No,No,1,0,150,1,24-02-2018,2018,2,24,February,Q1,8,Saturday,FQ-4
18429375,Sufiyan Restaurant,1,India,New Delhi,Zakir Nagar,77.27977898,28.56732117,Mughlai,Indian Rupees(Rs.),No,No,No,No,1,0,250,1,18-02-2016,2016,2,18,February,Q1,8,Thursday,FQ-4
312338,De Bone Chicken,1,India,New Delhi,Ashok Vihar Phase 1,77.1730688,28.6872543,"Raw Meats, Fast Food",Indian Rupees(Rs.),No,No,No,No,1,0,400,1,14-01-2013,2013,1,14,January,Q1,3,Monday,FQ-4
18469659,Arunachal Bhawan,1,India,New Delhi,Chanakyapuri,77.1980469,28.5986962,North Eastern,Indian Rupees(Rs.),No,No,No,No,1,0,350,1,17-01-2010,2010,1,17,January,Q1,4,Sunday,FQ-4
18438446,Madras Cafe,1,India,New Delhi,Geeta Colony,77.2665213,28.6598571,South Indian,Indian Rupees(Rs.),No,No,No,No,1,0,250,1,19-01-2013,2013,1,19,January,Q1,3,Saturday,FQ-4
18421470,Soya Twist,1,India,New Delhi,Geeta Colony,77.2766789,28.6545768,"North Indian, Chinese",Indian Rupees(Rs.),No,No,No,No,1,0,350,1,20-01-2014,2014,1,20,January,Q1,4,Monday,FQ-4
18423892,Fuel Diet Cafe,1,India,New Delhi,Krishna Nagar,77.2842188,28.6576075,Healthy Food,Indian Rupees(Rs.),No,No,No,No,1,0,350,1,04-01-2014,2014,1,4,January,Q1,1,Saturday,FQ-4
18423103,Ramlal Sweets,1,India,New Delhi,Krishna Nagar,77.2777667,28.6530845,Mithai,Indian Rupees(Rs.),No,No,No,No,1,0,100,1,25-01-2018,2018,1,25,January,Q1,4,Thursday,FQ-4
304469,Tirath Sweets,1,India,New Delhi,Moti Nagar,77.1400711,28.6570788,Mithai,Indian Rupees(Rs.),No,No,No,No,1,0,100,1,23-01-2016,2016,1,23,January,Q1,4,Saturday,FQ-4
18425178,Al Meraj Chicken Shop,1,India,New Delhi,Munirka,77.1707986,28.5587394,"Awadhi, Mughlai",Indian Rupees(Rs.),No,No,No,No,1,0,100,1,25-01-2015,2015,1,25,January,Q1,5,Sunday,FQ-4
18261710,Classic Chef Corner,1,India,New Delhi,Nangloi,77.03108288,28.68202569,"Chinese, North Indian",Indian Rupees(Rs.),No,No,No,No,1,0,400,1,19-01-2017,2017,1,19,January,Q1,3,Thursday,FQ-4
18261719,Sethi's Express,1,India,New Delhi,Nangloi,77.0713543,28.6529874,"South Indian, North Indian, Chinese",Indian Rupees(Rs.),No,No,No,No,1,0,350,1,24-01-2010,2010,1,24,January,Q1,5,Sunday,FQ-4
18464634,Swagi Food Corner,1,India,New Delhi,Nangloi,77.06931744,28.68172684,"Chinese, Fast Food",Indian Rupees(Rs.),No,No,No,No,1,0,250,1,22-01-2017,2017,1,22,January,Q1,4,Sunday,FQ-4
18378581,Maggi Point,1,India,New Delhi,Palam,77.101591,28.6006231,"Chinese, North Indian",Indian Rupees(Rs.),No,No,No,No,1,0,350,1,22-01-2013,2013,1,22,January,Q1,4,Tuesday,FQ-4
18435829,Wow! Momo,1,India,New Delhi,"Palate of Delhi, Chanakyapuri",77.162132,28.5921448,"Chinese, Fast Food",Indian Rupees(Rs.),No,No,No,No,1,0,350,1,27-01-2017,2017,1,27,January,Q1,4,Friday,FQ-4
18393448,Healthy Nutrienty,1,India,New Delhi,Pandav Nagar,77.2847055,28.6213699,"Beverages, Healthy Food",Indian Rupees(Rs.),No,No,No,No,1,0,250,1,14-01-2011,2011,1,14,January,Q1,3,Friday,FQ-4
18359285,Shaketastic,1,India,New Delhi,Prashant Vihar,77.1343223,28.7155806,Beverages,Indian Rupees(Rs.),No,No,No,No,1,0,250,1,18-01-2015,2015,1,18,January,Q1,4,Sunday,FQ-4
18441566,Fc Katyal,1,India,New Delhi,Preet Vihar,77.2959775,28.6424671,Chinese,Indian Rupees(Rs.),No,No,No,No,1,0,250,1,07-01-2016,2016,1,7,January,Q1,2,Thursday,FQ-4
18424648,Aggarwal Sweets,1,India,New Delhi,Vasundhara Enclave,77.30720289,28.59080159,"Mithai, Street Food",Indian Rupees(Rs.),No,No,No,No,1,0,100,1,06-01-2014,2014,1,6,January,Q1,2,Monday,FQ-4
18377900,Khan Tandoori Nights,1,India,New Delhi,Vasundhara Enclave,77.30676837,28.59133326,Mughlai,Indian Rupees(Rs.),No,No,No,No,1,0,400,1,12-01-2015,2015,1,12,January,Q1,3,Monday,FQ-4
18424200,Shahi Muradabadi Chicken Biryani,1,India,New Delhi,Vasundhara Enclave,77.3080751,28.5897432,Biryani,Indian Rupees(Rs.),No,No,No,No,1,0,150,1,26-01-2011,2011,1,26,January,Q1,5,Wednesday,FQ-4
18418262,Goyal Sweets,1,India,New Delhi,Vivek Vihar,77.31827907,28.67127679,"Mithai, Bakery",Indian Rupees(Rs.),No,No,No,No,1,0,150,1,16-01-2010,2010,1,16,January,Q1,3,Saturday,FQ-4
18421457,Jai Maa Shaarde Samose Wala,1,India,New Delhi,Anand Vihar,77.3171146,28.6603594,Street Food,Indian Rupees(Rs.),No,No,No,No,1,0,100,1,17-12-2013,2013,12,17,December,Q4,51,Tuesday,FQ-3
18446396,Nirula's Ice Cream,1,India,New Delhi,Ashok Vihar Phase 1,77.172323,28.694039,"Ice Cream, Desserts",Indian Rupees(Rs.),No,No,No,No,1,0,250,1,15-12-2017,2017,12,15,December,Q4,50,Friday,FQ-3
18265385,Aggarwal Sweet Corner,1,India,New Delhi,Dilshad Garden,77.31474,28.6789662,"Mithai, Street Food",Indian Rupees(Rs.),No,No,No,No,1,0,150,1,04-12-2013,2013,12,4,December,Q4,49,Wednesday,FQ-3
18273530,Mahi Rasoi,1,India,New Delhi,Majnu ka Tila,77.2275645,28.7003464,"North Indian, South Indian, Fast Food",Indian Rupees(Rs.),No,No,No,No,1,0,400,1,15-12-2015,2015,12,15,December,Q4,51,Tuesday,FQ-3
18492025,Bikaner Sweets,1,India,New Delhi,MG Road,77.1651082,28.4940407,"Mithai, North Indian, South Indian, Chinese, Street Food, Bakery",Indian Rupees(Rs.),No,No,No,No,1,0,400,1,14-12-2018,2018,12,14,December,Q4,50,Friday,FQ-3
18489819,Chinese Corner,1,India,New Delhi,MG Road,77.1451213,28.4940831,Chinese,Indian Rupees(Rs.),No,No,No,No,1,0,150,1,26-12-2018,2018,12,26,December,Q4,52,Wednesday,FQ-3
18034037,Green Chick Chop,1,India,New Delhi,MG Road,77.164633,28.4932439,"Raw Meats, North Indian, Fast Food",Indian Rupees(Rs.),No,No,No,No,1,0,350,1,20-12-2017,2017,12,20,December,Q4,51,Wednesday,FQ-3
18261151,Aujla's Punjabi Zaika,1,India,New Delhi,Nangloi,77.0700586,28.6521647,"North Indian, Chinese, Mughlai",Indian Rupees(Rs.),No,No,No,No,1,0,400,1,14-12-2017,2017,12,14,December,Q4,50,Thursday,FQ-3
18466387,Raju Fast Food,1,India,New Delhi,Nangloi,77.06034612,28.66742137,"Street Food, Fast Food",Indian Rupees(Rs.),No,No,No,No,1,0,250,1,12-12-2010,2010,12,12,December,Q4,51,Sunday,FQ-3
18371405,Brahm Point Fast Food,1,India,New Delhi,Naraina,77.137828,28.6319525,"Fast Food, Chinese",Indian Rupees(Rs.),No,No,No,No,1,0,150,1,17-12-2014,2014,12,17,December,Q4,51,Wednesday,FQ-3
18464625,China Kitchen,1,India,New Delhi,Narela,77.12731652,28.84061467,"Chinese, North Eastern",Indian Rupees(Rs.),No,No,No,No,1,0,350,1,28-12-2016,2016,12,28,December,Q4,53,Wednesday,FQ-3
18435330,Chowringhee,1,India,New Delhi,Narela,77.0356003,28.8002781,Fast Food,Indian Rupees(Rs.),No,No,No,No,1,0,250,1,17-12-2017,2017,12,17,December,Q4,51,Sunday,FQ-3
18375378,Welcome Family Restaurant,1,India,New Delhi,Narela,77.0895081,28.85510345,"North Indian, South Indian",Indian Rupees(Rs.),No,No,No,No,1,0,400,1,06-12-2017,2017,12,6,December,Q4,49,Wednesday,FQ-3
18293989,Smily Cakes,1,India,New Delhi,Pandav Nagar,77.29241386,28.62235249,Bakery,Indian Rupees(Rs.),No,No,No,No,1,0,250,1,27-12-2018,2018,12,27,December,Q4,52,Thursday,FQ-3
18427212,"34, Chowringhee Lane",1,India,New Delhi,R K Puram,77.1672543,28.5652136,"Fast Food, Mughlai, Armenian",Indian Rupees(Rs.),No,No,No,No,1,0,350,1,09-12-2014,2014,12,9,December,Q4,50,Tuesday,FQ-3
18486867,Alam Biryani,1,India,New Delhi,R K Puram,77.1784594,28.5642458,Biryani,Indian Rupees(Rs.),No,No,No,No,1,0,100,1,20-12-2017,2017,12,20,December,Q4,51,Wednesday,FQ-3
18465571,Smoke Trailer Grill,1,India,New Delhi,Sainik Farms,77.22338664,28.51195551,American,Indian Rupees(Rs.),No,No,No,No,1,0,400,1,15-12-2017,2017,12,15,December,Q4,50,Friday,FQ-3
18451605,Delhi-27,1,India,New Delhi,Subhash Nagar,77.1181788,28.6357662,"Chinese, South Indian",Indian Rupees(Rs.),No,No,No,No,1,0,250,1,27-12-2017,2017,12,27,December,Q4,52,Wednesday,FQ-3
18451597,Sanjay Chicken Shop,1,India,New Delhi,Subhash Nagar,77.1212104,28.637075,"Raw Meats, Fast Food",Indian Rupees(Rs.),No,No,No,No,1,0,350,1,18-12-2014,2014,12,18,December,Q4,51,Thursday,FQ-3
18492057,Shree Raja Ram,1,India,New Delhi,Subhash Nagar,77.1055523,28.6398129,Fast Food,Indian Rupees(Rs.),No,No,No,No,1,0,50,1,11-12-2011,2011,12,11,December,Q4,51,Sunday,FQ-3
18375387,Seven Star Pizza,1,India,New Delhi,Vasundhara Enclave,77.305843,28.5923018,Pizza,Indian Rupees(Rs.),No,No,No,No,1,0,400,1,09-12-2015,2015,12,9,December,Q4,50,Wednesday,FQ-3
18144471,Halal Pizza Star,1,India,New Delhi,Zakir Nagar,77.28120089,28.56717571,"Pizza, Fast Food",Indian Rupees(Rs.),No,No,No,No,1,0,450,1,08-12-2012,2012,12,8,December,Q4,49,Saturday,FQ-3
18425711,Ratan Singh,1,India,New Delhi,Chandni Chowk,77.2338244,28.6531118,Mithai,Indian Rupees(Rs.),No,No,No,No,1,0,50,1,28-11-2010,2010,11,28,November,Q4,49,Sunday,FQ-3
18421487,Best Biryani,1,India,New Delhi,Delhi University-GTB Nagar,77.2076069,28.69846,Mughlai,Indian Rupees(Rs.),No,No,No,No,1,0,400,1,07-11-2012,2012,11,7,November,Q4,45,Wednesday,FQ-3
18472605,Hot Kathi Roll,1,India,New Delhi,Hauz Khas,77.2097525,28.5601549,Fast Food,Indian Rupees(Rs.),No,No,No,No,1,0,250,1,25-11-2018,2018,11,25,November,Q4,48,Sunday,FQ-3
18419906,K. B. Eating Point,1,India,New Delhi,Jangpura,77.2603162,28.5798205,"Chinese, South Indian",Indian Rupees(Rs.),No,Yes,No,No,1,0,250,1,28-11-2010,2010,11,28,November,Q4,49,Sunday,FQ-3
18452241,Moriarty Delivers,1,India,New Delhi,Kailash Colony,77.2401111,28.5535184,Fast Food,Indian Rupees(Rs.),No,No,No,No,1,0,400,1,21-11-2011,2011,11,21,November,Q4,48,Monday,FQ-3
18376495,Chai Garam,1,India,New Delhi,Krishna Nagar,77.28349753,28.65748122,"Beverages, Fast Food",Indian Rupees(Rs.),No,No,No,No,1,0,150,1,02-11-2010,2010,11,2,November,Q4,45,Tuesday,FQ-3
18378861,Preechen,1,India,New Delhi,Lawrence Road,77.1576386,28.6918615,"North Indian, Fast Food",Indian Rupees(Rs.),No,No,No,No,1,0,400,1,12-11-2011,2011,11,12,November,Q4,46,Saturday,FQ-3
18356819,Mathura Lassi Wala,1,India,New Delhi,Mahipalpur,77.125056,28.5438292,"North Indian, Chinese, South Indian",Indian Rupees(Rs.),No,No,No,No,1,0,250,1,27-11-2010,2010,11,27,November,Q4,48,Saturday,FQ-3
18489802,Zaika Biryani,1,India,New Delhi,MG Road,77.1457358,28.4936685,"Mughlai, North Indian",Indian Rupees(Rs.),No,No,No,No,1,0,350,1,16-11-2010,2010,11,16,November,Q4,47,Tuesday,FQ-3
304573,Chinese Corner,1,India,New Delhi,Moti Nagar,77.1428234,28.6588187,"Fast Food, Chinese",Indian Rupees(Rs.),No,No,No,No,1,0,350,1,27-11-2018,2018,11,27,November,Q4,48,Tuesday,FQ-3
18466410,Delhi Chaat Bhandar,1,India,New Delhi,Mukherjee Nagar,77.2087734,28.7130677,Street Food,Indian Rupees(Rs.),No,No,No,No,1,0,50,1,07-11-2015,2015,11,7,November,Q4,45,Saturday,FQ-3
18354994,Chinese Food Corner,1,India,New Delhi,Munirka,77.1729675,28.5568298,"Chinese, North Indian",Indian Rupees(Rs.),No,No,No,No,1,0,400,1,26-11-2011,2011,11,26,November,Q4,48,Saturday,FQ-3
18429155,Green Chick Chop,1,India,New Delhi,Najafgarh,76.9858424,28.6072328,"Raw Meats, North Indian, Fast Food",Indian Rupees(Rs.),No,No,No,No,1,0,350,1,04-11-2011,2011,11,4,November,Q4,45,Friday,FQ-3
18471319,Grover Burfee & Cakes,1,India,New Delhi,Najafgarh,76.9853771,28.6095844,"Bakery, Chinese",Indian Rupees(Rs.),No,No,No,No,1,0,250,1,02-11-2012,2012,11,2,November,Q4,44,Friday,FQ-3
304809,Aggarwal Sweets Corner,1,India,New Delhi,Nangloi,77.08195768,28.69273348,Mithai,Indian Rupees(Rs.),No,No,No,No,1,0,100,1,03-11-2011,2011,11,3,November,Q4,45,Thursday,FQ-3
9181,Bhardwaj Bakery,1,India,New Delhi,Nangloi,77.06424572,28.67784092,"Bakery, Pizza",Indian Rupees(Rs.),No,No,No,No,1,0,100,1,14-11-2013,2013,11,14,November,Q4,46,Thursday,FQ-3
9226,Deep Bakery And Cake,1,India,New Delhi,Nangloi,77.066475,28.6803916,"Bakery, Desserts",Indian Rupees(Rs.),No,No,No,No,1,0,100,1,06-11-2010,2010,11,6,November,Q4,45,Saturday,FQ-3
18355004,Cafe Point,1,India,New Delhi,Okhla Phase 2,77.278399,28.5344146,"Fast Food, Beverages",Indian Rupees(Rs.),No,No,No,No,1,0,100,1,02-11-2015,2015,11,2,November,Q4,45,Monday,FQ-3
18440436,New Shama Chicken Restaurant,1,India,New Delhi,Pandav Nagar,77.2849549,28.6210849,Biryani,Indian Rupees(Rs.),No,No,No,No,1,0,350,1,18-11-2018,2018,11,18,November,Q4,47,Sunday,FQ-3
18163895,Cafe Coffee Day,1,India,New Delhi,Shakarpur,77.2813787,28.6329113,Cafe,Indian Rupees(Rs.),No,No,No,No,1,0,450,1,13-11-2013,2013,11,13,November,Q4,46,Wednesday,FQ-3
18445788,Niti Shake & Ice Cream Hub,1,India,New Delhi,Shalimar Bagh,77.1566379,28.7154009,"Desserts, Beverages",Indian Rupees(Rs.),No,No,No,No,1,0,400,1,10-11-2015,2015,11,10,November,Q4,46,Tuesday,FQ-3
18381265,Food N Shakes,1,India,New Delhi,Uttam Nagar,77.0617981,28.6199415,"Chinese, Fast Food",Indian Rupees(Rs.),No,No,No,No,1,0,250,1,28-11-2013,2013,11,28,November,Q4,48,Thursday,FQ-3
18424208,Riyaz Biryani Corner,1,India,New Delhi,Vasundhara Enclave,77.30837971,28.58980772,"Biryani, North Indian",Indian Rupees(Rs.),No,No,No,No,1,0,150,1,10-11-2015,2015,11,10,November,Q4,46,Tuesday,FQ-3
18252382,Grills N Chills,1,India,New Delhi,Yusuf Sarai,77.2084945,28.5577692,Fast Food,Indian Rupees(Rs.),No,No,No,No,1,0,350,1,12-11-2014,2014,11,12,November,Q4,46,Wednesday,FQ-3
18478997,Sidhi Cafe,1,India,New Delhi,Yusuf Sarai,77.2132249,28.5616007,"Street Food, Fast Food",Indian Rupees(Rs.),No,No,No,No,1,0,100,1,21-11-2014,2014,11,21,November,Q4,47,Friday,FQ-3
18361763,Best Biryani Centre,1,India,New Delhi,GTB Nagar,77.2077365,28.6984564,Biryani,Indian Rupees(Rs.),No,No,No,No,1,0,350,1,07-10-2015,2015,10,7,October,Q4,41,Wednesday,FQ-3
18464621,Om Ji Bhature Wale,1,India,New Delhi,Gujranwala Town,77.1894954,28.7017374,Street Food,Indian Rupees(Rs.),No,No,No,No,1,0,100,1,14-10-2011,2011,10,14,October,Q4,42,Friday,FQ-3
18486830,Radhe Shyam Chole Bhature,1,India,New Delhi,Jangpura,77.2490554,28.5827894,Street Food,Indian Rupees(Rs.),No,No,No,No,1,0,100,1,17-10-2015,2015,10,17,October,Q4,42,Saturday,FQ-3
18203154,Red Chili Potato,1,India,New Delhi,Karol Bagh,77.2027979,28.65867981,Chinese,Indian Rupees(Rs.),No,No,No,No,1,0,150,1,28-10-2015,2015,10,28,October,Q4,44,Wednesday,FQ-3
18357561,Bigbee,1,India,New Delhi,Lawrence Road,77.158043,28.6916764,Bakery,Indian Rupees(Rs.),No,No,No,No,1,0,100,1,01-10-2012,2012,10,1,October,Q4,40,Monday,FQ-3
18440186,Chennai Express Greens,1,India,New Delhi,Laxmi Nagar,77.2773871,28.6306676,South Indian,Indian Rupees(Rs.),No,No,No,No,1,0,250,1,22-10-2012,2012,10,22,October,Q4,43,Monday,FQ-3
18396177,Pasta Pizza & Roll Hut,1,India,New Delhi,Mukherjee Nagar,77.2090421,28.7140827,"Italian, Fast Food",Indian Rupees(Rs.),No,No,No,No,1,0,350,1,16-10-2011,2011,10,16,October,Q4,43,Sunday,FQ-3
18449643,Tea Point,1,India,New Delhi,Mukherjee Nagar,77.2146844,28.7120416,"Beverages, Fast Food",Indian Rupees(Rs.),No,No,No,No,1,0,150,1,17-10-2010,2010,10,17,October,Q4,43,Sunday,FQ-3
18471270,Chicken Darwar,1,India,New Delhi,Najafgarh,76.9622705,28.6361375,"Fast Food, Mughlai",Indian Rupees(Rs.),No,No,No,No,1,0,350,1,16-10-2016,2016,10,16,October,Q4,43,Sunday,FQ-3
18352288,Mittal Restaurant & Fast Food,1,India,New Delhi,Najafgarh,76.9852777,28.6091697,"Fast Food, South Indian, Mithai",Indian Rupees(Rs.),No,No,No,No,1,0,400,1,04-10-2017,2017,10,4,October,Q4,40,Wednesday,FQ-3
18430570,Shree Shyam Sweets,1,India,New Delhi,Najafgarh,76.9879296,28.6024678,Street Food,Indian Rupees(Rs.),No,No,No,No,1,0,150,1,25-10-2012,2012,10,25,October,Q4,43,Thursday,FQ-3
304822,Bansiwala Sweets & Caterers,1,India,New Delhi,Nangloi,77.02933475,28.68263808,"Mithai, Street Food",Indian Rupees(Rs.),No,No,No,No,1,0,100,1,18-10-2012,2012,10,18,October,Q4,42,Thursday,FQ-3
18312662,Dabas Ke Special Chole Bhature,1,India,New Delhi,Nangloi,77.0287839,28.68247071,Street Food,Indian Rupees(Rs.),No,No,No,No,1,0,100,1,18-10-2013,2013,10,18,October,Q4,42,Friday,FQ-3
18261708,JMD Family Restaurant,1,India,New Delhi,Nangloi,77.0228319,28.6467438,"North Indian, Chinese",Indian Rupees(Rs.),No,No,No,No,1,0,400,1,15-10-2014,2014,10,15,October,Q4,42,Wednesday,FQ-3
18430905,Ram Ram Ji Kachori Bhandar,1,India,New Delhi,Subhash Nagar,77.1079298,28.6360338,Street Food,Indian Rupees(Rs.),No,No,No,No,1,0,50,1,09-10-2012,2012,10,9,October,Q4,41,Tuesday,FQ-3
18356794,Pal Restaurant,1,India,New Delhi,Tilak Nagar,77.1014529,28.6445351,"North Indian, Chinese",Indian Rupees(Rs.),No,No,No,No,1,0,250,1,06-10-2012,2012,10,6,October,Q4,40,Saturday,FQ-3
18446390,New Bhappe Di Hatti,1,India,New Delhi,Vivek Vihar,77.312115,28.669247,Fast Food,Indian Rupees(Rs.),No,No,No,No,1,0,100,1,13-10-2015,2015,10,13,October,Q4,42,Tuesday,FQ-3
18420424,South Indian Food Plaza,1,India,New Delhi,Vivek Vihar,77.31824689,28.66696569,South Indian,Indian Rupees(Rs.),No,No,No,No,1,0,250,1,05-10-2018,2018,10,5,October,Q4,40,Friday,FQ-3
18445274,Motu N Patlu,1,India,New Delhi,Zakir Nagar,77.28506528,28.56624639,"Lebanese, North Indian, Fast Food",Indian Rupees(Rs.),No,No,No,No,1,0,250,1,14-10-2014,2014,10,14,October,Q4,42,Tuesday,FQ-3
18454461,Zaika Muradabadi,1,India,New Delhi,East of Kailash,77.250781,28.560295,Biryani,Indian Rupees(Rs.),No,Yes,No,No,1,0,200,1,20-02-2010,2010,2,20,February,Q1,8,Saturday,FQ-4
18412904,Kettle & Kegs,1,India,New Delhi,Green Park,77.2049011,28.557068,Tea,Indian Rupees(Rs.),No,Yes,No,No,1,0,200,1,27-12-2017,2017,12,27,December,Q4,52,Wednesday,FQ-3
18414481,Kettle & Kegs,1,India,New Delhi,Connaught Place,77.23041,28.636975,Tea,Indian Rupees(Rs.),No,Yes,No,No,1,0,200,1,17-11-2013,2013,11,17,November,Q4,47,Sunday,FQ-3
18313109,Mom's Bake,1,India,New Delhi,Delhi Cantt.,77.12170769,28.59346375,"Bakery, Fast Food",Indian Rupees(Rs.),No,No,No,No,1,0,200,1,18-09-2012,2012,9,18,September,Q3,38,Tuesday,FQ-2
18463978,Lucky Corner Shop,1,India,New Delhi,GTB Nagar,77.2048186,28.6961012,Fast Food,Indian Rupees(Rs.),No,No,No,No,1,0,200,1,05-09-2010,2010,9,5,September,Q3,37,Sunday,FQ-2
18396684,Al Naseem Foods Shawarma,1,India,New Delhi,Karol Bagh,77.2,28.66,Fast Food,Indian Rupees(Rs.),No,No,No,No,1,0,200,1,11-09-2011,2011,9,11,September,Q3,38,Sunday,FQ-2
18415338,Kathi House,1,India,New Delhi,Mehrauli,77.192373,28.5278328,Fast Food,Indian Rupees(Rs.),No,No,No,No,1,0,200,1,24-09-2011,2011,9,24,September,Q3,39,Saturday,FQ-2
18232989,Kitchen Namaste,1,India,New Delhi,MG Road,77.1618543,28.4997301,"North Indian, Chinese",Indian Rupees(Rs.),No,No,No,No,1,0,200,1,21-09-2010,2010,9,21,September,Q3,39,Tuesday,FQ-2
304753,Baketown By Gagan Bakers,1,India,New Delhi,Nangloi,77.05472823,28.68232512,"Fast Food, Bakery",Indian Rupees(Rs.),No,No,No,No,1,0,200,1,13-09-2011,2011,9,13,September,Q3,38,Tuesday,FQ-2
18431177,Biryani Express,1,India,New Delhi,Naraina,77.136788,28.6286826,Biryani,Indian Rupees(Rs.),No,No,No,No,1,0,200,1,28-09-2013,2013,9,28,September,Q3,39,Saturday,FQ-2
18363089,Chill Out,1,India,New Delhi,Wazirpur,77.1633809,28.6797201,Ice Cream,Indian Rupees(Rs.),No,No,No,No,1,0,200,1,25-09-2013,2013,9,25,September,Q3,39,Wednesday,FQ-2
18294257,Chilli Chinese,1,India,New Delhi,Wazirpur,77.1636597,28.6792749,Chinese,Indian Rupees(Rs.),No,No,No,No,1,0,200,1,25-09-2015,2015,9,25,September,Q3,39,Friday,FQ-2
18377915,Tulsi Ram Chinese Hut,1,India,New Delhi,Anand Vihar,77.3062409,28.6595326,Chinese,Indian Rupees(Rs.),No,No,No,No,1,0,200,1,22-08-2017,2017,8,22,August,Q3,34,Tuesday,FQ-2
18481289,Chaipiyoji,1,India,New Delhi,Green Park,77.2028955,28.5579188,"Tea, Fast Food",Indian Rupees(Rs.),No,No,No,No,1,0,200,1,22-08-2010,2010,8,22,August,Q3,35,Sunday,FQ-2
18431175,Urban Patty House,1,India,New Delhi,GTB Nagar,77.2050359,28.6944781,Fast Food,Indian Rupees(Rs.),No,No,No,No,1,0,200,1,03-08-2011,2011,8,3,August,Q3,32,Wednesday,FQ-2
18361743,Amul Ice-Cream Parlour,1,India,New Delhi,Gujranwala Town,77.1919823,28.6982502,Ice Cream,Indian Rupees(Rs.),No,No,No,No,1,0,200,1,16-08-2015,2015,8,16,August,Q3,34,Sunday,FQ-2
18364336,Cherry Berry,1,India,New Delhi,Gujranwala Town,77.1899876,28.6943365,"Bakery, Desserts",Indian Rupees(Rs.),No,No,No,No,1,0,200,1,20-08-2017,2017,8,20,August,Q3,34,Sunday,FQ-2
18433297,China Pan,1,India,New Delhi,Mehrauli,77.190347,28.5265467,"Chinese, Fast Food",Indian Rupees(Rs.),No,No,No,No,1,0,200,1,19-08-2011,2011,8,19,August,Q3,34,Friday,FQ-2
18449827,Amit Dhaba,1,India,New Delhi,Moti Nagar,77.1389292,28.6576159,Fast Food,Indian Rupees(Rs.),No,No,No,No,1,0,200,1,24-08-2014,2014,8,24,August,Q3,35,Sunday,FQ-2
18471287,Punjabi Rasoi,1,India,New Delhi,Najafgarh,76.9622191,28.6359913,Fast Food,Indian Rupees(Rs.),No,No,No,No,1,0,200,1,23-08-2017,2017,8,23,August,Q3,34,Wednesday,FQ-2
18419871,Scoopers 'n' Bakers,1,India,New Delhi,Vivek Vihar,77.31213246,28.66842304,Bakery,Indian Rupees(Rs.),No,No,No,No,1,0,200,1,06-08-2011,2011,8,6,August,Q3,32,Saturday,FQ-2
18424593,Chatkara,1,India,New Delhi,Green Park,77.2024756,28.5566575,Street Food,Indian Rupees(Rs.),No,No,No,No,1,0,200,1,09-07-2014,2014,7,9,July,Q3,28,Wednesday,FQ-2
18464647,Taoji Ke Amratsari Naan,1,India,New Delhi,Nangloi,77.02335276,28.64712056,"Fast Food, North Indian",Indian Rupees(Rs.),No,No,No,No,1,0,200,1,12-07-2011,2011,7,12,July,Q3,29,Tuesday,FQ-2
313163,A Patisseries Gallery,1,India,New Delhi,Naraina,77.14178972,28.6286201,"Bakery, Desserts",Indian Rupees(Rs.),No,No,No,No,1,0,200,1,17-07-2011,2011,7,17,July,Q3,30,Sunday,FQ-2
18345771,Foodieholic,1,India,New Delhi,Qutab Institutional Area,77.18569312,28.54150757,"Chinese, North Indian, South Indian",Indian Rupees(Rs.),No,No,No,No,1,0,200,1,23-07-2018,2018,7,23,July,Q3,30,Monday,FQ-2
18441710,Sangam Ratna,1,India,New Delhi,Shakarpur,77.2807813,28.6302107,South Indian,Indian Rupees(Rs.),No,No,No,No,1,0,200,1,26-07-2016,2016,7,26,July,Q3,31,Tuesday,FQ-2
18479000,Shri Balaji,1,India,New Delhi,Yusuf Sarai,77.2073832,28.5598243,South Indian,Indian Rupees(Rs.),No,No,No,No,1,0,200,1,27-07-2015,2015,7,27,July,Q3,31,Monday,FQ-2
18419897,Shahi Muradabadi & Hyderabadi,1,India,New Delhi,Jangpura,77.2622917,28.5771398,Mughlai,Indian Rupees(Rs.),No,No,No,No,1,0,200,1,19-06-2017,2017,6,19,June,Q2,25,Monday,FQ-1
18361199,Bikaner Sweets & Restaurant,1,India,New Delhi,Najafgarh,76.9759687,28.6157878,"Mithai, South Indian, Street Food",Indian Rupees(Rs.),No,No,No,No,1,0,200,1,24-06-2017,2017,6,24,June,Q2,25,Saturday,FQ-1
18359300,Frontier,1,India,New Delhi,Prashant Vihar,77.1340901,28.7143111,Bakery,Indian Rupees(Rs.),No,No,No,No,1,0,200,1,17-06-2016,2016,6,17,June,Q2,25,Friday,FQ-1
18492065,Alam Biryani Center,1,India,New Delhi,Zakir Nagar,77.27966331,28.56771457,Biryani,Indian Rupees(Rs.),No,No,No,No,1,0,200,1,02-06-2015,2015,6,2,June,Q2,23,Tuesday,FQ-1
18462596,Lala Chaap Corner,1,India,New Delhi,Chandni Chowk,77.233113,28.6526767,Fast Food,Indian Rupees(Rs.),No,No,No,No,1,0,200,1,16-05-2015,2015,5,16,May,Q2,20,Saturday,FQ-1
18371416,Bake Town,1,India,New Delhi,Najafgarh,76.9906888,28.6125711,"Bakery, Chinese",Indian Rupees(Rs.),No,No,No,No,1,0,200,1,27-05-2018,2018,5,27,May,Q2,22,Sunday,FQ-1
18435331,Khurana Eating Point,1,India,New Delhi,Geeta Colony,77.2772052,28.6465239,Chinese,Indian Rupees(Rs.),No,No,No,No,1,0,200,1,27-04-2012,2012,4,27,April,Q2,17,Friday,FQ-1
18258502,Schezwan Bakery,1,India,New Delhi,IP Extension,77.3065335,28.6304877,"Bakery, Fast Food",Indian Rupees(Rs.),No,No,No,No,1,0,200,1,26-04-2015,2015,4,26,April,Q2,18,Sunday,FQ-1
18481322,Shankar Chinese Foods,1,India,New Delhi,Jangpura,77.2422216,28.5794004,"Chinese, Fast Food",Indian Rupees(Rs.),No,No,No,No,1,0,200,1,03-04-2013,2013,4,3,April,Q2,14,Wednesday,FQ-1
18458655,Singh Chinese Fast Food,1,India,New Delhi,Kamla Nagar,77.1991559,28.6675893,Chinese,Indian Rupees(Rs.),No,No,No,No,1,0,200,1,13-04-2011,2011,4,13,April,Q2,16,Wednesday,FQ-1
18486869,Hot & Tasty,1,India,New Delhi,R K Puram,77.1884619,28.5658333,Chinese,Indian Rupees(Rs.),No,No,No,No,1,0,200,1,20-04-2015,2015,4,20,April,Q2,17,Monday,FQ-1
18355137,Kalka's Food Centre,1,India,New Delhi,Sainik Farms,77.2062486,28.5183803,"North Indian, Chinese",Indian Rupees(Rs.),No,No,No,No,1,0,200,1,04-04-2013,2013,4,4,April,Q2,14,Thursday,FQ-1
18438463,Choksi Chinese,1,India,New Delhi,Mayur Vihar Phase 1,77.3086422,28.5899497,Chinese,Indian Rupees(Rs.),No,No,No,No,1,0,200,1,22-03-2010,2010,3,22,March,Q1,13,Monday,FQ-4
18489825,Cake And Bakes,1,India,New Delhi,MG Road,77.1449374,28.4941305,Bakery,Indian Rupees(Rs.),No,No,No,No,1,0,200,1,05-03-2017,2017,3,5,March,Q1,10,Sunday,FQ-4
18489532,Gujjar Dhaba,1,India,New Delhi,MG Road,77.124642,28.4801014,"Mughlai, North Indian",Indian Rupees(Rs.),No,No,No,No,1,0,200,1,25-03-2013,2013,3,25,March,Q1,13,Monday,FQ-4
18471254,Annpurna Rasoi,1,India,New Delhi,Najafgarh,76.9967933,28.6283564,"North Indian, Fast Food",Indian Rupees(Rs.),No,No,No,No,1,0,200,1,07-03-2012,2012,3,7,March,Q1,10,Wednesday,FQ-4
18465802,Aradhya Restaurant,1,India,New Delhi,Saket,77.19819423,28.51751975,"Chinese, North Indian",Indian Rupees(Rs.),No,No,No,No,1,0,200,1,24-03-2018,2018,3,24,March,Q1,12,Saturday,FQ-4
18357939,Devika Restaurant,1,India,New Delhi,Sarita Vihar,77.2985607,28.5378528,South Indian,Indian Rupees(Rs.),No,No,No,No,1,0,200,1,14-03-2012,2012,3,14,March,Q1,11,Wednesday,FQ-4
18409189,Just Veg,1,India,New Delhi,Shakarpur,77.2813547,28.6329214,Chinese,Indian Rupees(Rs.),No,No,No,No,1,0,200,1,01-03-2017,2017,3,1,March,Q1,9,Wednesday,FQ-4
18388132,TiffinToons,1,India,New Delhi,Delhi University-GTB Nagar,77.19461525,28.69248552,"North Indian, South Indian",Indian Rupees(Rs.),No,No,No,No,1,0,200,1,10-02-2012,2012,2,10,February,Q1,6,Friday,FQ-4
18425177,Aazad Chicken Corner,1,India,New Delhi,Green Park,77.2057995,28.5584086,"Biryani, Mughlai",Indian Rupees(Rs.),No,No,No,No,1,0,200,1,23-02-2011,2011,2,23,February,Q1,9,Wednesday,FQ-4
18494989,Games v/s Cafe,1,India,New Delhi,Mayur Vihar Phase 1,77.29572514,28.6067005,"Cafe, Beverages",Indian Rupees(Rs.),No,No,No,No,1,0,200,1,17-02-2010,2010,2,17,February,Q1,8,Wednesday,FQ-4
18472695,Chinese Fast Food,1,India,New Delhi,Mehrauli,77.1919008,28.5279728,"Chinese, Fast Food",Indian Rupees(Rs.),No,No,No,No,1,0,200,1,21-02-2017,2017,2,21,February,Q1,8,Tuesday,FQ-4
307560,Creambell & Chocoxess,1,India,New Delhi,"Pacific Mall, Tagore Garden",77.1064559,28.6423578,"Ice Cream, Desserts",Indian Rupees(Rs.),No,No,No,No,1,0,200,1,16-02-2014,2014,2,16,February,Q1,8,Sunday,FQ-4
313127,Aggarwal Sweets,1,India,New Delhi,R K Puram,77.181991,28.5647404,"South Indian, Chinese, Mithai",Indian Rupees(Rs.),No,No,No,No,1,0,200,1,27-02-2012,2012,2,27,February,Q1,9,Monday,FQ-4
18128881,Bablu Chinese Food,1,India,New Delhi,Dilshad Garden,77.3221198,28.6766439,Fast Food,Indian Rupees(Rs.),No,No,No,No,1,0,200,1,06-01-2014,2014,1,6,January,Q1,2,Monday,FQ-4
18421474,Bhatia Chinese Food,1,India,New Delhi,Krishna Nagar,77.2821467,28.6551369,"Chinese, South Indian, Fast Food",Indian Rupees(Rs.),No,No,No,No,1,0,200,1,02-01-2018,2018,1,2,January,Q1,1,Tuesday,FQ-4
301786,Bhagat Ji Sweets,1,India,New Delhi,Palam,77.10086,28.597615,Fast Food,Indian Rupees(Rs.),No,No,No,No,1,0,200,1,21-01-2017,2017,1,21,January,Q1,3,Saturday,FQ-4
18429149,Special Moradabadi Chicken Corner,1,India,New Delhi,Subhash Nagar,77.1055921,28.6393914,Biryani,Indian Rupees(Rs.),No,No,No,No,1,0,200,1,25-01-2018,2018,1,25,January,Q1,4,Thursday,FQ-4
18420428,Cheese Bitez Pizza,1,India,New Delhi,Vivek Vihar,77.31822677,28.667041,Fast Food,Indian Rupees(Rs.),No,No,No,No,1,0,200,1,14-01-2012,2012,1,14,January,Q1,2,Saturday,FQ-4
18354330,Momolicious,1,India,New Delhi,Green Park,77.20243322,28.5589794,Fast Food,Indian Rupees(Rs.),No,No,No,No,1,0,200,1,04-12-2017,2017,12,4,December,Q4,49,Monday,FQ-3
18472689,Naya Adda,1,India,New Delhi,Lado Sarai,77.1918882,28.5280987,Fast Food,Indian Rupees(Rs.),No,No,No,No,1,0,200,1,05-12-2017,2017,12,5,December,Q4,49,Tuesday,FQ-3
18451144,Tummyy Tull,1,India,New Delhi,Moti Nagar,77.1424589,28.6585987,Fast Food,Indian Rupees(Rs.),No,No,No,No,1,0,200,1,21-12-2015,2015,12,21,December,Q4,52,Monday,FQ-3
18431998,Laxmi Food Corner,1,India,New Delhi,Najafgarh,76.9856999,28.6130409,"Fast Food, North Indian",Indian Rupees(Rs.),No,No,No,No,1,0,200,1,03-12-2018,2018,12,3,December,Q4,49,Monday,FQ-3
18430576,Shahi Chicken Point,1,India,New Delhi,Najafgarh,76.993457,28.5905484,Mughlai,Indian Rupees(Rs.),No,No,No,No,1,0,200,1,28-12-2017,2017,12,28,December,Q4,52,Thursday,FQ-3
18462571,Happy Hours,1,India,New Delhi,Naraina,77.1357857,28.6223096,"Chinese, Fast Food",Indian Rupees(Rs.),No,No,No,No,1,0,200,1,24-12-2015,2015,12,24,December,Q4,52,Thursday,FQ-3
306657,N.S. Pizza Point,1,India,New Delhi,Palam,77.068668,28.6040477,Pizza,Indian Rupees(Rs.),No,No,No,No,1,0,200,1,16-12-2011,2011,12,16,December,Q4,51,Friday,FQ-3
18486866,Gupta Ji Ka Dhaba,1,India,New Delhi,R K Puram,77.1762403,28.5659833,"North Indian, Mughlai, Armenian",Indian Rupees(Rs.),No,No,No,No,1,0,200,1,26-12-2015,2015,12,26,December,Q4,52,Saturday,FQ-3
18447302,Wakhra Swag,1,India,New Delhi,Jangpura,77.2569041,28.5744768,"South Indian, Chinese, Fast Food",Indian Rupees(Rs.),No,No,No,No,1,0,200,1,25-11-2017,2017,11,25,November,Q4,47,Saturday,FQ-3
18486879,Truly Yours,1,India,New Delhi,MG Road,77.1603672,28.4975835,"North Indian, Street Food, Fast Food",Indian Rupees(Rs.),No,No,No,No,1,0,200,1,25-11-2016,2016,11,25,November,Q4,48,Friday,FQ-3
18313125,Mehtaab Sweet Corner & Restaurant,1,India,New Delhi,Najafgarh,76.9621244,28.6360808,"North Indian, Chinese, Street Food",Indian Rupees(Rs.),No,No,No,No,1,0,200,1,12-11-2010,2010,11,12,November,Q4,46,Friday,FQ-3
312161,Flavours Of London,1,India,New Delhi,Palam,77.0910041,28.5885001,"Ice Cream, Bakery",Indian Rupees(Rs.),No,No,No,No,1,0,200,1,02-11-2016,2016,11,2,November,Q4,45,Wednesday,FQ-3
308832,Hot 'N' Cool,1,India,New Delhi,Preet Vihar,77.2909535,28.6342767,"Fast Food, Italian",Indian Rupees(Rs.),No,No,No,No,1,0,200,1,20-11-2013,2013,11,20,November,Q4,47,Wednesday,FQ-3
